Customer_ID,Prefix,First_Name,Middle_Name,Last_Name,Suffix,Gender,DoB,Address
2299,DR.,KIMBERLY,,WRIGHT,,F,10/25/2011,6416; Gabriella Heights Avenue; Stockbridge&; <30012>; US
2300,MRS.,TAMMIE,,SCOTT,,F,9/13/1998,132; David Haven Spring; Kaukauna&; <30057>; US
2301,DR.,SHANNON,,HILL,,F,12/31/1988,707; Garrett Run River; South Lawndale&; <30056>; US
2302,DR.,SARAH,,KELLER,,F,7/14/1906,89603; Jennifer Curve Flat; Keizer&; <30064>; US
2303,MRS.,MIRANDA,,BARTLETT,,F,7/24/1960,146; Tara Lock Hollow; Kendall&; <30017>; US
2304,DR.,MARK,,SAUNDERS,,M,08/02/2013,84; Gregory Mission Wall; West Des Moines&; <30068>; US
2305,MRS.,BRITTANY,,JOHNSON,,F,10/15/1964,988; Jennifer Port Summit; Pahrump&; <30007>; US
2306,MS.,DIANA,,HARRISON,,F,3/21/1973,738; Jean Crescent Manors; Toledo&; <30022>; US
2307,DR.,NICOLE,,ROJAS,,F,11/12/1928,92243; Joseph Mission Plaza; Greenpoint&; <30082>; US
2308,MR.,JAMES,,RICHARDSON,,M,1/27/1913,9447; Schmidt Place Viaduct; Muskogee&; <30068>; US
2309,MS.,MELISSA,,RASMUSSEN,,F,02/10/1987,27877; Anthony Forks Lights; Pleasant Prairie&; <30029>; US
2310,DR.,EARL,,ROBERTS,,M,08/11/1932,42847; Kyle Coves Haven; Gates-North Gates&; <30014>; US
2311,MRS.,YVONNE,,HENSON,,F,6/23/1937,513; Lane Stravenue Mission; Front Royal&; <30047>; US
2312,MR.,WILLIAM,,GRAY,,M,6/17/1954,6232; Green Tunnel Islands; Redding&; <30036>; US
2313,MR.,THOMAS,,ROTH,,M,01/02/1987,65983; Smith Underpass Stream; Bridgeport&; <30028>; US
2314,MRS.,MARIE,,HARTMAN,,F,8/31/2009,8143; Curtis Parkways Roads; Fairview Heights&; <30014>; US
2315,DR.,KIM,,LEE,,F,3/24/1992,808; Julia Circles Turnpike; Fitchburg&; <30031>; US
2316,MR.,TYLER,,BENSON,,M,11/13/2005,4418; Cortez Unions Ways; Thomasville&; <30036>; US
2317,MRS.,ASHLEY,,JENSEN,,F,12/15/1995,3835; Meyer Viaduct Lane; Peabody&; <30045>; US
2318,DR.,ROBIN,,HENDERSON,,F,02/01/1909,42671; William Fall Corner; Granger&; <30009>; US
2319,DR.,DANIEL,,GIBBS,,M,02/08/1969,54022; Duarte Drive Rue; Fitchburg&; <30016>; US
2320,MR.,BRIAN,,ALVAREZ,,M,08/06/1977,652; Erik Landing Forges; Iron River&; <30067>; US
2321,MR.,STEVEN,,JOHNSON,,M,10/28/1979,4207; Ford Mission Vista; Carlsbad&; <30069>; US
2322,MS.,HEIDI,,FARRELL,,F,11/08/2015,408; Megan Ranch Corners; Gainesville&; <30001>; US
2323,DR.,THOMAS,,LEE,,M,08/12/1987,12578; Donald Canyon Union; Ada&; <30009>; US
2324,DR.,REGINALD,,MARSHALL,,M,11/07/1929,7772; William Dam Drives; West Des Moines&; <30015>; US
2325,MRS.,KELLIE,,FLOYD,,F,03/09/1973,570; Patrick Turnpike Grove; Fitchburg&; <30088>; US
2326,DR.,HANNAH,,CHEN,,F,9/22/1985,5967; Fletcher Valleys Lakes; Claremont&; <30023>; US
2327,MRS.,MAUREEN,,WOOD,,F,04/07/1985,7470; Hester Land Valley; Collinwood&; <30027>; US
2328,MRS.,HEATHER,,GRANT,,F,11/06/1995,147; Patrick Stream Courts; Indio&; <30079>; US
2329,DR.,JOYCE,,SANCHEZ,,F,7/13/1936,495; Santos Union Dam; Brenham&; <30002>; US
2330,DR.,ALYSSA,,GILL,,F,06/04/2007,84552; Matthew Cape Estates; Pekin&; <30019>; US
2331,DR.,AMANDA,,MARTINEZ,,F,1/17/1955,654; Joshua Rapid Flats; Claremont&; <30084>; US
2332,MR.,MASON,,FREEMAN,,M,6/24/1943,81304; Walker Turnpike Motorway; Rosedale&; <30045>; US
2333,MR.,WILLIAM,,SMITH,,M,4/29/1928,124; Debra Harbors Curve; Shreveport&; <30096>; US
2334,MRS.,CAROL,,TERRY,,F,3/26/1965,60901; Joshua Keys Springs; Pekin&; <30067>; US
2335,MR.,JAMES,,GARRISON,,M,11/25/1980,50660; Skinner Plaza Views; Newburgh&; <30019>; US
2336,MRS.,KATHERINE,,WAGNER,,F,4/23/1908,661; Burke Coves Ville; Hutchinson&; <30072>; US
2337,MISS,ANGELA,,BECKER,,F,8/27/1918,20027; Lori Corner Light; Brenham&; <30032>; US
2338,MRS.,AMY,,ORTEGA,,F,12/04/1928,3196; Roberta Ways Knolls; Norco&; <30026>; US
2339,DR.,JULIA,,ROTH,,F,12/13/1984,89646; Ingram Plains Motorway; Iron River&; <30072>; US
2340,MR.,PAUL,,WALTON,,M,12/27/1942,744; Rogers Route Harbors; Encinitas&; <30024>; US
2341,DR.,TIMOTHY,,REESE,,M,1/25/1915,879; Jeanette Corner Burg; Bourbonnais&; <30072>; US
2342,DR.,BRETT,,EDWARDS,,M,1/24/1952,21743; Riley Mission Mount; Lino Lakes&; <30088>; US
2343,MISS,NICOLE,,WILLIAMS,,F,04/01/1936,8072; Jamie Isle Corners; Lebanon&; <30092>; US
2344,MRS.,CHRISTINA,,STEIN,,F,02/04/1996,280; Fleming Shore Track; Lutz&; <30029>; US
2345,MRS.,DONNA,,KERR,,F,1/19/1945,145; Green Meadows Shore; Greenville&; <30044>; US
2346,MRS.,MARIE,,LONG,,F,8/25/1987,2141; Amanda Mount Bridge; Middle River&; <30019>; US
2347,MRS.,VICTORIA,,REED,,F,11/16/1921,36013; Charles Row Drives; Copperas Cove&; <30065>; US
2348,MRS.,RACHEL,,LEE,,F,1/20/1909,63154; Yvonne Junction Pike; South Lawndale&; <30094>; US
2349,MR.,WILLIAM,,THOMAS,,M,8/25/1999,5583; Hall Forks Turnpike; Nutley&; <30098>; US
2350,DR.,MATTHEW,,TAYLOR,,M,9/16/1939,414; Angela Coves Corners; Kahului&; <30022>; US
2351,MR.,JONATHAN,,MARTIN,,M,02/06/1955,7271; John Fort Ferry; Santa Maria&; <30096>; US
2352,MS.,CYNTHIA,,PEREZ,,F,12/08/1992,181; Oneal Crossroad Trail; Bridgeport&; <30063>; US
2353,DR.,RICK,,JOHNSON,,M,7/21/1954,6545; Browning Hill Estate; Milledgeville&; <30033>; US
2354,MR.,JOEL,,PHILLIPS,,M,7/31/1961,884; Caleb Junctions Greens; Greenville&; <30079>; US
2355,MR.,THOMAS,,RAY,,M,11/18/1990,291; Pittman Squares Keys; San Gabriel&; <30068>; US
2356,MR.,TIM,,GONZALEZ,,M,05/05/1972,41823; Sonya Summit Island; Claremont&; <30051>; US
2357,MR.,RALPH,,HANSEN,,M,11/21/1965,63436; Vasquez Ramp Mission; Murray&; <30076>; US
2358,MRS.,TANYA,,HENDERSON,,F,9/19/1926,90283; Nichols Wells Park; Evergreen Park&; <30028>; US
2359,MR.,BRADLEY,,WELLS,,M,05/10/1913,909; Clayton Ville Locks; Massapequa&; <30023>; US
2360,MRS.,BRITTANY,,HARRIS,,F,10/31/1948,862; Melissa Port Tunnel; Porterville&; <30049>; US
2361,MR.,ADAM,,CASTILLO,,M,5/26/1993,901; Cameron Inlet Land; Troutdale&; <30077>; US
2362,MR.,THOMAS,,PIERCE,,M,02/09/1931,58551; Crawford Camp Highway; Carlsbad&; <30040>; US
2363,DR.,DIANE,,VARGAS,,F,12/02/1915,97127; Kimberly Shoal Skyway; Newburgh&; <30093>; US
2364,DR.,RICHARD,,WILLIAMS,,M,3/26/1996,96958; Johnson Circles Ports; Grand Forks&; <30088>; US
2365,MRS.,JEAN,,SUTTON,,F,12/30/2013,533; Durham Highway Lodge; Tyler&; <30025>; US
2366,MS.,KATHRYN,,TURNER,,F,2/13/1998,33933; Latoya Flat Motorway; Gates-North Gates&; <30010>; US
2367,MRS.,TINA,,REYNOLDS,,F,11/16/1981,2683; Kyle Club Loop; Norco&; <30025>; US
2368,MRS.,LISA,,JONES,,F,08/01/1930,34723; Collins Camp Course; Searcy&; <30080>; US
2369,MISS,MELISSA,,THOMPSON,,F,02/02/1906,90320; Abigail Ranch Manors; Martinsburg&; <30073>; US
2370,MR.,JONATHAN,,LOPEZ,,M,10/15/1949,52244; David Villages Lane; Evergreen Park&; <30007>; US
2371,MR.,BRANDON,,WEST,,M,11/02/1923,4833; Montoya Roads Drive; Copperas Cove&; <30079>; US
2372,DR.,SUSAN,,JAMES,,F,8/25/2002,7497; Jennifer Crescent Fords; Kahului&; <30037>; US
2373,DR.,HELEN,,SANCHEZ,,F,05/11/1954,96; Steven Villages Villages; Visitacion Valley&; <30005>; US
2374,MR.,DANIEL,,LINDSEY,,M,10/29/1965,4735; Mary Drive Knolls; Granger&; <30003>; US
2375,MR.,RICHARD,,JOHNSON,,M,02/03/1974,1839; Schmitt Overpass Turnpike; Grand Forks&; <30006>; US
2376,DR.,JUAN,,SULLIVAN,,M,1/26/1990,3847; Cheryl Centers Pine; Gilbert&; <30086>; US
2377,DR.,LAUREN,,BERGER,,F,10/21/2014,89062; Heather Coves Grove; Lino Lakes&; <30045>; US
2378,MRS.,ANNE,,CALDWELL,,F,04/07/1985,8109; Frederick Fords Port; Rosedale&; <30038>; US
2379,MRS.,JAMIE,,HARVEY,,F,8/18/2013,15366; Perez Summit Key; Bryn Mawr-Skyway&; <30009>; US
2380,MR.,DERRICK,,WOODARD,,M,3/26/1910,64721; Valencia Common Harbor; Westchester&; <30012>; US
2381,MRS.,SHARON,,WEAVER,,F,5/19/1990,1771; Fuller Shores Ridge; Rutland&; <30079>; US
2382,MISS,SUZANNE,,MARTINEZ,,F,5/15/1937,5774; Deleon Mall Hollow; Waterbury&; <30088>; US
2383,MR.,EDWIN,,GARCIA,,M,6/23/1988,86139; Davis Glens Trafficway; Laguna Niguel&; <30076>; US
2384,MR.,PHILLIP,,ORTIZ,,M,08/09/1948,162; Gomez Rest Road; Stockbridge&; <30053>; US
2385,DR.,ANGELA,,MULLEN,,F,12/05/1989,485; Bennett Mall Spurs; Tyler&; <30033>; US
2386,MR.,MATTHEW,,CONLEY,,M,02/01/1990,5192; John Shoal Rest; Far Rockaway&; <30031>; US
2387,DR.,ANDREW,,DELGADO,,M,8/31/2009,59571; Phillips Dam Throughway; Dumont&; <30092>; US
2388,MS.,AMANDA,,NGUYEN,,F,12/06/1954,52962; Howard Mountains Junction; Thomasville&; <30024>; US
2389,MISS,TINA,,JACKSON,,F,08/07/1932,194; Sarah Extension Avenue; Opportunity&; <30051>; US
2390,MRS.,ISABELLA,,YOUNG,,F,08/10/1946,9899; Edwards Extensions Parkways; Sterling&; <30049>; US
2391,MR.,FRANCISCO,,NUNEZ,,M,05/08/2020,58599; Hernandez Station Way; Sun City Center&; <30030>; US
2392,MR.,MICHAEL,,YOUNG,,M,06/03/2008,907; Garza Via Tunnel; Copperas Cove&; <30052>; US
2393,MR.,JESSE,,MORGAN,,M,6/19/1982,394; Heather Hills Underpass; San Juan&; <30096>; US
2394,MR.,JOHN,,WYATT,,M,10/01/2006,903; Wright Freeway Hill; Bothell West&; <30089>; US
2395,MRS.,BARBARA,,WILSON,,F,12/21/1910,70559; Shane Turnpike Trace; Brighton Beach&; <30051>; US
2396,DR.,JOHN,,RIVERS,,M,04/04/2017,200; Amy Meadow Island; Encinitas&; <30042>; US
2397,DR.,CLAYTON,,ROY,,M,2/14/1952,6932; Diane Summit Mountains; Milledgeville&; <30020>; US
2398,MR.,JACOB,,GIBBS,,M,4/17/1968,973; Anthony Points Shores; Bryn Mawr-Skyway&; <30074>; US
2399,DR.,JESSICA,,BLACK,,F,09/09/1979,53407; Sweeney Green Green; Beaumont&; <30072>; US
2400,MS.,BECKY,,LEWIS,,F,3/13/1998,16922; Karen Shore Forge; Milledgeville&; <30035>; US
2401,DR.,THOMAS,,COSTA,,M,8/14/2015,479; Amanda Greens Forks; Mechanicsville&; <30053>; US
2402,MR.,DANIEL,,BLAKE,,M,06/05/1999,198; Laura Knoll Mills; Palestine&; <30098>; US
2403,DR.,BARRY,,ROBERSON,,M,11/01/1916,2331; Dorothy Coves Circles; Milledgeville&; <30095>; US
2404,MRS.,DEBRA,,BROWN,,F,7/14/1961,3906; Thomas Ridge Inlet; Milledgeville&; <30035>; US
2405,MRS.,BROOKE,,DANIELS,,F,09/03/1986,78437; Daniel Port Lakes; Tupelo&; <30090>; US
2406,MR.,CASEY,,MCCORMICK,,M,03/02/2005,13471; Dillon Course Harbor; Belle Glade&; <30095>; US
2407,MRS.,ANDREA,,FLYNN,,F,1/14/2015,884; Antonio Lodge Lights; Massapequa&; <30025>; US
2408,DR.,ROBERT,,STANLEY,,M,7/29/1994,19; Oconnor Estate Manor; Redding&; <30052>; US
2409,MRS.,EBONY,,SMITH,,F,9/15/1966,16837; Daugherty Coves Estates; Bothell&; <30024>; US
2410,MRS.,PATRICIA,,CASE,,F,11/22/1908,8824; Gina Mount Crossroad; Santa Maria&; <30088>; US
2411,MR.,RONALD,,GRIFFIN,,M,06/07/1977,981; Jason Road Pine; Hueytown&; <30042>; US
2412,DR.,MICHELLE,,ROGERS,,F,02/03/1984,29506; Joseph Views Field; Scotch Plains&; <30057>; US
2413,MRS.,DAISY,,JONES,,F,11/18/1910,5938; Christine Spurs Port; Fairview Heights&; <30026>; US
2414,MR.,MICHAEL,,HERNANDEZ,,M,04/08/1985,465; Owen Stravenue Brooks; Fairview Heights&; <30099>; US
2415,MRS.,VANESSA,,HARRIS,,F,08/12/1994,37; Christina Forges Motorway; Covington&; <30051>; US
2416,MRS.,STACIE,,WARREN,,F,9/14/1949,51993; Nicholas Coves Divide; Davis&; <30077>; US
2417,DR.,DEBRA,,STRICKLAND,,F,04/07/1930,75460; Brandt Valley Mount; Gates-North Gates&; <30023>; US
2418,DR.,CHELSEA,,GRIFFIN,,F,02/08/1994,8872; Stacy Harbor Junctions; Dublin&; <30094>; US
2419,DR.,TAMMY,,WEBSTER,,F,08/07/1952,8220; Moore Route Mews; Santa Maria&; <30047>; US
2420,MRS.,MARY,,LOVE,,F,12/13/1954,7568; Anthony Turnpike Freeway; Belle Glade&; <30047>; US
2421,DR.,VICTORIA,,FINLEY,,F,10/10/1938,21009; Becky Tunnel Drive; South Whittier&; <30008>; US
2422,MR.,DOUGLAS,,BOONE,,M,2/24/2008,6973; Jensen Dam Island; Thomasville&; <30027>; US
2423,MR.,ANDREW,,MARTINEZ,,M,09/05/1970,18612; Hernandez Plain Port; Abilene&; <30091>; US
2424,MRS.,KARI,,ZAVALA,,F,11/22/1980,530; Christine Plains Avenue; Port Richmond&; <30087>; US
2425,DR.,MITCHELL,,SANTOS,,M,3/24/1926,770; Cynthia Valley Plain; American Canyon&; <30046>; US
2426,MRS.,BRITTANY,,WEAVER,,F,11/28/2010,9523; Hicks Vista Expressway; Palm Valley&; <30052>; US
2427,MRS.,MELISSA,,DAY,,F,11/15/1992,89242; Kent Station Overpass; Brighton Beach&; <30068>; US
2428,MR.,GARY,,MORGAN,,M,07/09/1969,8741; Susan Brook Ford; Huntley&; <30019>; US
2429,MRS.,DAISY,,BRADLEY,,F,9/22/1994,95780; Long Prairie Locks; Acworth&; <30083>; US
2430,MRS.,ELIZABETH,,FROST,,F,2/24/1946,3569; Cathy Union Union; Brenham&; <30083>; US
2431,MR.,MATTHEW,,TAYLOR,,M,11/08/1964,85748; Derrick Flat Meadows; Gilbert&; <30053>; US
2432,MRS.,SANDRA,,CASTRO,,F,5/25/1996,8949; Summer Landing Divide; Norco&; <30097>; US
2433,MRS.,LINDSEY,,RIVAS,,F,10/06/1943,617; Rowe Keys Square; Laguna Niguel&; <30085>; US
2434,MRS.,ANGELA,,HATFIELD,,F,02/06/1988,998; Matthew Ports Cove; Evergreen Park&; <30043>; US
2435,DR.,CRYSTAL,,VAUGHN,,F,7/27/1916,791; Veronica Pass Inlet; Port Richmond&; <30039>; US
2436,MR.,RONALD,,BELL,,M,10/21/1916,669; Sarah Dale Roads; Abilene&; <30044>; US
2437,DR.,MICHAEL,,JACKSON,,M,09/08/1910,2114; Robert Burgs Mountains; Martinsburg&; <30023>; US
2438,MR.,NICHOLAS,,COOPER,,M,03/04/1936,134; Shawn Grove Trail; Peabody&; <30021>; US
2439,MR.,CHRISTOPHER,,THOMPSON,,M,8/22/2013,90; Stephanie Junctions Square; Woodbridge&; <30020>; US
2440,MR.,ROBERT,,DAVIS,,M,2/22/1968,69836; Parker Parkway Isle; Pekin&; <30057>; US
2441,MS.,KATHY,,BROWN,,F,01/02/2004,8771; Brown Park Light; Norwalk&; <30085>; US
2442,DR.,CODY,,WATTS,,M,07/05/1979,631; Stephanie Locks Cliff; Muskogee&; <30076>; US
2443,MR.,KYLE,,THOMPSON,,M,08/08/1940,248; Elizabeth Row Shore; Encinitas&; <30029>; US
2444,MISS,KRISTEN,,MEDINA,,F,8/27/1962,484; Miller Manors Inlet; North Lauderdale&; <30058>; US
2445,DR.,WILLIAM,,RICE,,M,3/26/1933,4437; Bobby Valley Lodge; Westchester&; <30066>; US
2446,MR.,LAWRENCE,,TORRES,,M,11/06/1965,4611; Eric Views Shoal; Lompoc&; <30004>; US
2447,MISS,JACQUELINE,,CARROLL,,F,10/20/1935,662; Jonathan Field Village; Scotch Plains&; <30079>; US
2448,MR.,DEVIN,,ROWLAND,,M,8/13/1945,63423; Robert Plain River; Jackson&; <30011>; US
2449,MR.,TRAVIS,,WALKER,,M,09/06/2002,792; Eric Inlet Loop; Lino Lakes&; <30057>; US
2450,DR.,JOSEPH,,SMITH,,M,1/23/2020,452; Corey Heights Viaduct; Redding&; <30043>; US
2451,MR.,TIMOTHY,,SOTO,,M,11/21/1936,1924; Bradley Drive Rest; Norco&; <30052>; US
2452,DR.,TIMOTHY,,JIMENEZ,,M,8/21/1930,87774; Matthew Haven Locks; Gainesville&; <30033>; US
2453,DR.,VANESSA,,HUGHES,,F,2/13/1979,157; Kathryn Fort Flats; Leland&; <30011>; US
2454,DR.,ERIN,,GALLOWAY,,F,02/01/2003,48058; Donald Lock Ramp; Lower West Side&; <30030>; US
2455,MRS.,KIMBERLY,,SHEPHERD,,F,6/13/1987,58457; Mary Fork Streets; Tupelo&; <30061>; US
2456,MR.,ROBERT,,SIMON,,M,09/12/1950,8173; Contreras Locks Throughway; Scotch Plains&; <30085>; US
2457,DR.,HALEY,,WILLIAMS,,F,03/10/1940,66; Reyes Crossroad Park; Gainesville&; <30093>; US
2458,MR.,RICHARD,,MIRANDA,,M,12/18/1993,91812; Jerry Grove Burg; Kearns&; <30024>; US
2459,DR.,MICHELE,,HARRISON,,F,10/11/1930,936; David Groves Ford; Fresno&; <30032>; US
2460,DR.,LINDSEY,,NELSON,,F,05/08/1971,6442; Beck Fords Ways; Pleasant Prairie&; <30072>; US
2461,MRS.,DIANA,,ZUNIGA,,F,08/04/1981,952; Dorsey Plaza Gateway; Kensington&; <30032>; US
2462,DR.,AMY,,WHITAKER,,F,1/27/1961,2965; Carson Ridges Bridge; Tyler&; <30045>; US
2463,DR.,HOLLY,,STOKES,,F,07/07/2002,97425; Rodgers Spur Stravenue; Aloha&; <30017>; US
2464,DR.,JEANETTE,,MALONE,,F,1/20/1927,32427; Boyer Walk Meadow; Troutdale&; <30037>; US
2465,DR.,CHARLES,,CRUZ,,M,05/05/1933,8798; Joshua Wells Pike; Lexington&; <30041>; US
2466,MR.,PAUL,,WARD,,M,10/17/1920,295; Quinn Row Turnpike; Clermont&; <30091>; US
2467,MRS.,JEANETTE,,BENDER,,F,8/25/1998,1161; Holt Mission Forks; Harrisburg&; <30096>; US
2468,DR.,REGINA,,RICHMOND,,F,6/15/1979,499; Lutz Courts Mission; Scottsdale&; <30092>; US
2469,MRS.,CHERYL,,WILLIAMS,,F,3/31/2020,24050; Jeffery View Gateway; Keene&; <30071>; US
2470,MR.,CHRISTOPHER,,MEYER,,M,06/05/1935,212; Jessica Stream Garden; Rosedale&; <30099>; US
2471,DR.,WYATT,,GATES,,M,3/20/2012,6175; Marshall Canyon Isle; Milledgeville&; <30060>; US
2472,MRS.,CHRISTINE,,MOORE,,F,09/09/1924,764; Serrano Harbors Crest; Murray&; <30090>; US
2473,DR.,TIMOTHY,,WADE,,M,10/19/2013,3528; Johnson Pike Ford; Copperas Cove&; <30066>; US
2474,DR.,MALLORY,,LYNN,,F,4/15/1970,167; Paul Lodge Unions; Saratoga Springs&; <30024>; US
2475,MR.,XAVIER,,SMALL,,M,9/27/1908,684; Clark Gateway Squares; Carlsbad&; <30052>; US
2476,DR.,MICHELE,,ALLEN,,F,9/17/1971,665; Oneal Rest Burg; Thomasville&; <30077>; US
2477,DR.,JADE,,WARREN,,F,5/14/1986,6653; Danielle Locks Road; Far Rockaway&; <30039>; US
2478,MR.,VINCENT,,VEGA,,M,8/30/2009,235; Terri Ferry Flat; Acworth&; <30016>; US
2479,DR.,CONNOR,,GRAHAM,,M,10/16/1926,97577; Isaac Summit Lake; Collinwood&; <30036>; US
2480,MRS.,MEGAN,,WOOD,,F,6/26/1964,574; Stone Wall Valleys; Rosedale&; <30035>; US
2481,DR.,KEITH,,WEAVER,,M,10/17/1983,3501; Gould Loaf Cliffs; Opportunity&; <30049>; US
2482,MR.,ANDREW,,ROGERS,,M,7/23/1953,883; Carrillo Summit Burg; Acworth&; <30064>; US
2483,MR.,STEVEN,,TAPIA,,M,11/20/1907,46523; Shawn Union Trail; Kent&; <30022>; US
2484,DR.,TYLER,,MARTINEZ,,M,12/20/1989,5362; Meghan Street Run; Brentwood Estates&; <30023>; US
2485,MISS,STEPHANIE,,HAWKINS,,F,03/02/1981,281; Rocha Canyon Walks; Estelle&; <30037>; US
2486,MR.,NICHOLAS,,MORGAN,,M,7/21/1949,7429; Lori Point Cape; Stockbridge&; <30050>; US
2487,MR.,ROBERT,,ALVAREZ,,M,1/23/1976,928; Janet Ports Mountains; Opportunity&; <30006>; US
2488,MRS.,RACHEL,,ROMAN,,F,7/26/1950,5181; Autumn Square Mills; Kensington&; <30009>; US
2489,MR.,DEVIN,,HALL,,M,12/08/1922,9843; Robinson Heights Grove; Jackson&; <30097>; US
2490,MR.,SAMUEL,,KNIGHT,,M,7/26/1972,533; Kimberly Rapids Point; Acworth&; <30083>; US
2491,DR.,JAMES,,MUNOZ,,M,02/11/2018,40; Salinas Ridges Circles; Kaukauna&; <30056>; US
2492,MRS.,CHRISTINA,,BROWN,,F,08/04/1946,24873; Susan Forks Trace; Fairview Heights&; <30060>; US
2493,MISS,ANGELA,,HIGGINS,,F,8/20/1905,249; Smith Inlet Mount; Gates-North Gates&; <30056>; US
2494,MRS.,COURTNEY,,GONZALES,,F,04/02/1911,2238; Kirk Overpass Prairie; Thomasville&; <30037>; US
2495,MR.,JAMES,,MAXWELL,,M,5/23/1946,29742; Robertson Harbors Island; Sun City Center&; <30075>; US
2496,MRS.,SHANNON,,RANDOLPH,,F,10/24/2010,737; Byrd Ridges Crescent; Ken Caryl&; <30046>; US
2497,MS.,STACY,,COLE,,F,3/26/1908,873; Morris Park Shoals; Copperas Cove&; <30009>; US
2498,DR.,MARIA,,MEYERS,,F,3/26/1986,4502; Bowman Shoals Mountains; Bothell West&; <30038>; US
2499,MR.,RICHARD,,HOWELL,,M,7/29/2013,377; Espinoza Parks Parks; Peabody&; <30053>; US
2500,MISS,LORI,,COMPTON,,F,8/21/1930,608; Joel Rest Villages; San Gabriel&; <30055>; US
2501,MISS,KIMBERLY,,THORNTON,,F,5/27/1910,65400; David Turnpike Road; Kahului&; <30024>; US
2502,DR.,JAMIE,,LAWRENCE,,F,09/07/1930,270; Gina Plaza Orchard; Kahului&; <30001>; US
2503,MRS.,ANGIE,,SUTTON,,F,10/07/1959,25524; Isaiah Ridges Trafficway; Martinsburg&; <30095>; US
2504,DR.,JENNIFER,,SMITH,,F,01/08/1914,59160; Reyes Manor Ways; San Juan&; <30037>; US
2505,MR.,BENJAMIN,,TYLER,,M,2/13/1957,44484; David Highway Meadow; Kendall&; <30086>; US
2506,DR.,DAISY,,SHANNON,,F,2/29/2008,6947; Molly Alley Union; Punta Gorda Isles&; <30067>; US
2507,MRS.,JANET,,CRAWFORD,,F,02/11/1994,9612; Stephanie Skyway Wall; Bothell&; <30086>; US
2508,MRS.,ALLISON,,CRUZ,,F,5/24/1951,3703; Manuel Springs Vista; Brenham&; <30055>; US
2509,DR.,AMY,,JOHNSON,,F,05/08/1983,8727; Clark Avenue Harbors; South Lawndale&; <30064>; US
2510,MISS,JESSICA,,WEST,,F,9/20/1936,92869; Stevens Street Terrace; Norwalk&; <30057>; US
2511,MR.,MATTHEW,,LUTZ,,M,05/10/1942,4837; Tanner Glen Forges; Utica&; <30024>; US
2512,DR.,KIMBERLY,,COHEN,,F,11/23/1971,63790; Brown Crossroad Rapid; Covington&; <30096>; US
2513,MRS.,ELIZABETH,,GAY,,F,11/08/1944,7990; Rebecca Terrace Fall; Collinwood&; <30086>; US
2514,MR.,DAVID,,THOMAS,,M,11/25/1967,8355; Rice Place Manor; West Chester&; <30092>; US
2515,MRS.,ELIZABETH,,BECKER,,F,10/02/1935,274; Johnson Fields Manor; Columbia Heights&; <30016>; US
2516,DR.,PATRICIA,,ASHLEY,,F,1/20/1943,3966; Ortiz Parks Plains; Middletown&; <30030>; US
2517,DR.,JESUS,,CARLSON,,M,03/01/1952,7951; Carl Brooks Crescent; Acworth&; <30010>; US
2518,MR.,MICHAEL,,MCLEAN,,M,11/12/1970,37771; Martinez Tunnel Cliff; Lino Lakes&; <30097>; US
2519,MRS.,ERICA,,HENRY,,F,6/16/1971,7668; Kim Gateway View; Fayetteville&; <30053>; US
2520,MRS.,KIMBERLY,,CARLSON,,F,08/02/1971,15506; Pamela Gateway Squares; Front Royal&; <30009>; US
2521,DR.,CATHERINE,,SANDERS,,F,04/08/1955,26684; Harrell Street Prairie; Bryn Mawr-Skyway&; <30070>; US
2522,MS.,JULIE,,TAYLOR,,F,2/14/1994,720; Shannon Shore Viaduct; Schererville&; <30092>; US
2523,MRS.,TARA,,MCPHERSON,,F,2/23/1947,563; Jason Club Falls; Laguna Niguel&; <30043>; US
2524,MRS.,WHITNEY,,WILLIAMS,,F,9/15/2010,12800; Johnson Harbor Stravenue; San Gabriel&; <30059>; US
2525,DR.,RENEE,,JACKSON,,F,8/30/1966,8608; Allen Isle Shore; Chillum&; <30061>; US
2526,MR.,MICHAEL,,SMITH,,M,10/14/1947,69; Parker Causeway Flat; Brentwood Estates&; <30079>; US
2527,MRS.,PAIGE,,GARCIA,,F,8/17/1970,26382; Lindsay Court Estate; Longview&; <30011>; US
2528,DR.,KIMBERLY,,MATA,,F,12/15/1905,3406; Rhonda Plain Squares; Malden&; <30051>; US
2529,MRS.,LINDA,,PERRY,,F,09/03/1913,9252; Michael Harbors Station; Westchester&; <30015>; US
2530,MR.,JERRY,,BLACK,,M,10/22/1991,617; Hamilton Drive Ferry; Granger&; <30066>; US
2531,MRS.,SARA,,GOMEZ,,F,9/14/1963,268; Jeffrey Vista Knoll; Beaumont&; <30020>; US
2532,MISS,LAURA,,ESPINOZA,,F,12/30/1952,29681; Olson Square Crossing; Greenville&; <30018>; US
2533,MRS.,DEBRA,,WILKERSON,,F,01/04/2013,813; Thompson Mill Square; Pekin&; <30009>; US
2534,MR.,BRANDON,,TAPIA,,M,07/02/1953,81674; Herrera Lodge Circle; Scottsdale&; <30077>; US
2535,MR.,THOMAS,,GOOD,,M,11/06/1910,5207; Smith Loaf Via; Martinsburg&; <30034>; US
2536,MR.,CHRISTOPHER,,VALDEZ,,M,10/01/2006,36421; Robert Springs Cove; South Lawndale&; <30009>; US
2537,MISS,JILL,,MILLER,,F,03/06/1936,3455; Anthony Groves Mews; Ken Caryl&; <30081>; US
2538,DR.,TIFFANY,,CASTRO,,F,04/05/1912,657; Tammy Vista Dale; Cypress Hills&; <30013>; US
2539,MRS.,ERIN,,SANCHEZ,,F,6/24/1981,98792; Hannah Ville Trace; Pekin&; <30044>; US
2540,DR.,CRYSTAL,,BRYANT,,F,3/25/2009,81837; Jackson Path Station; Redding&; <30088>; US
2541,DR.,COREY,,AVILA,,M,08/08/1956,37369; Elizabeth Roads Courts; Punta Gorda Isles&; <30039>; US
2542,MRS.,MEGAN,,PHILLIPS,,F,02/04/1937,8542; Bradley Ridges Cape; Bothell West&; <30005>; US
2543,MRS.,TAMARA,,NASH,,F,11/03/1958,16169; Clark Mountains Flats; Riverbank&; <30073>; US
2544,MRS.,KIMBERLY,,BROWN,,F,3/17/1926,79107; Patrick Station Rapid; Morningside Heights&; <30028>; US
2545,MR.,MARK,,MELTON,,M,3/28/1976,658; Sarah Park Crossing; Opportunity&; <30068>; US
2546,DR.,ALICIA,,MURRAY,,F,9/20/1972,85601; Little Flat Gateway; Bourbonnais&; <30065>; US
2547,MR.,JACOB,,GUZMAN,,M,8/14/1913,699; Sheryl Unions Spurs; Sunnyside&; <30005>; US
2548,DR.,LORI,,HILL,,F,4/24/1980,91672; Mitchell Courts Dam; Longview&; <30037>; US
2549,DR.,LISA,,WILSON,,F,6/16/1978,90204; Kristina Courts Spur; Greenfield&; <30034>; US
2550,MR.,JEREMY,,JOHNSON,,M,03/12/1947,7984; Robin Mountains Mews; Sun City Center&; <30017>; US
2551,MISS,HAYLEY,,ARMSTRONG,,F,01/08/1958,8303; Marshall Trail Forge; Watsonville&; <30005>; US
2552,MISS,ADRIENNE,,HENDERSON,,F,6/30/1912,5673; David Squares Port; Middletown&; <30084>; US
2553,DR.,PHILLIP,,MYERS,,M,9/24/1977,26529; Johnson Garden Ports; Sicklerville&; <30085>; US
2554,MRS.,SARAH,,RICH,,F,07/09/1933,956; Penny Views Square; Coralville&; <30014>; US
2555,MR.,WALTER,,JOHNSON,,M,12/30/2016,16843; Whitehead Motorway Hills; Longview&; <30043>; US
2556,MR.,JAMES,,DIAZ,,M,05/08/2001,996; Williams Stream View; Vestavia Hills&; <30062>; US
2557,MR.,ANDREW,,WU,,M,9/29/1916,83585; Martin Drives Fields; Fort Washington&; <30069>; US
2558,MRS.,JENNIFER,,PRUITT,,F,5/18/2010,1567; Kimberly Shores Fords; Davis&; <30020>; US
2559,MRS.,ANGELA,,GRANT,,F,12/27/1975,22670; Wood Parkways Forest; Mechanicsville&; <30088>; US
2560,MRS.,KATHLEEN,,HENDERSON,,F,03/12/2009,3522; Miller Run Canyon; Yonkers&; <30099>; US
2561,DR.,CRAIG,,GOOD,,M,05/07/1928,5913; Hicks Greens Throughway; Brentwood Estates&; <30082>; US
2562,MR.,MICHAEL,,LAWRENCE,,M,3/26/1970,63222; Vanessa Neck Point; American Canyon&; <30025>; US
2563,MISS,HOLLY,,HUNT,,F,5/31/1957,676; Jones Causeway Loop; Toledo&; <30084>; US
2564,MR.,MATTHEW,,WILLIAMS,,M,6/28/1908,728; Jaime Coves Hollow; Schererville&; <30089>; US
2565,MRS.,GLENDA,,STANLEY,,F,01/08/1911,295; Stacey Road Tunnel; Rolla&; <30017>; US
2566,MS.,COURTNEY,,TORRES,,F,7/14/1915,238; Norton Flat Dale; Gainesville&; <30059>; US
2567,MRS.,MAKAYLA,,SANFORD,,F,11/12/1933,5599; Norris Locks Track; Redding&; <30059>; US
2568,MR.,SETH,,WRIGHT,,M,06/07/1923,356; Richard Loaf Trail; Visitacion Valley&; <30044>; US
2569,DR.,ALEXANDRA,,HARRIS,,F,3/30/1970,438; Mathews Viaduct Overpass; Harrisburg&; <30052>; US
2570,MR.,CHRISTOPHER,,POWERS,,M,5/30/1914,290; Robinson View Forges; Ken Caryl&; <30016>; US
2571,MR.,JOHN,,BISHOP,,M,08/03/2005,23; Christine Islands Corners; Hutchinson&; <30078>; US
2572,MR.,JOSHUA,,GREEN,,M,4/19/1927,4263; Mitchell Falls Neck; Leland&; <30052>; US
2573,DR.,MEGHAN,,SMITH,,F,04/05/1961,13914; Brooks Trafficway Field; New Canaan&; <30014>; US
2574,MS.,CRYSTAL,,ELLIOTT,,F,9/21/2004,11284; Boyd Station Ville; Middletown&; <30093>; US
2575,MRS.,HEATHER,,MURRAY,,F,5/30/1950,60857; Vanessa Tunnel Island; Leland&; <30087>; US
2576,DR.,JOSHUA,,JENKINS,,M,7/14/1958,578; Williams Neck Burgs; Mira Mesa&; <30081>; US
2577,DR.,JOHNATHAN,,GRAY,,M,12/13/1981,4502; Hodges Mountain Inlet; Dumont&; <30064>; US
2578,MR.,ALEC,,CALDWELL,,M,02/11/1931,17967; Rubio Rest Freeway; Rosedale&; <30037>; US
2579,DR.,KAITLYN,,DELGADO,,F,8/22/1982,904; Katrina Radial Track; Lower West Side&; <30009>; US
2580,MR.,CHRIS,,GREEN,,M,07/09/1993,46801; Moore Islands Divide; Sicklerville&; <30002>; US
2581,MR.,JOSEPH,,WALLACE,,M,12/19/1948,41530; Michael Rapid Trail; Scottsdale&; <30036>; US
