Customer_ID,Prefix,First_Name,Middle_Name,Last_Name,Suffix,Gender,DoB,Address
1,MR.,PAUL,,SHELTON,,M,01/02/1908,225; Hanson Stravenue Spring; Porterville&; <30001>; US
2,MRS.,LISA,,CLARKE,,F,06/03/1928,95071; Jamie Street Plain; Bourbonnais&; <30080>; US
3,DR.,LEE,,HARRISON,,M,12/30/2019,84857; Joshua Cape Course; Nutley&; <30024>; US
4,MS.,CHLOE,,JONES,,F,5/21/2012,538; Paul Forge Ports; Palestine&; <30020>; US
5,MRS.,KRISTEN,,JACKSON,,F,11/13/1910,253; Cordova Run Rapid; Acworth&; <30060>; US
6,MISS,MONICA,,PITTS,,F,10/10/1930,8551; Shari Underpass Mews; Beaumont&; <30071>; US
7,MRS.,KATELYN,,GORDON,,F,11/21/1928,88933; James Street Spurs; Thomasville&; <30052>; US
8,MR.,CORY,,NEWTON,,M,8/25/2013,920; Gregory Fall Mews; Nutley&; <30023>; US
9,MR.,DANIEL,,LEE,,M,11/05/1917,23384; Randall Pines Square; Gates-North Gates&; <30020>; US
10,MR.,JUSTIN,,ROSS,,M,12/08/2009,801; Jake Union Bridge; Vestavia Hills&; <30098>; US
11,MRS.,JILL,,TAYLOR,,F,8/13/1985,638; Hansen Circle Views; Hutchinson&; <30066>; US
12,MR.,ANTHONY,,WALKER,,M,06/03/2020,698; Michael Heights Fort; Indio&; <30049>; US
13,MISS,SANDRA,,ANDERSON,,F,08/02/2017,169; Prince Port Motorway; Longview&; <30072>; US
14,MRS.,TIFFANY,,SCHROEDER,,F,2/27/1957,9538; Thomas Mission Prairie; Grand Forks&; <30024>; US
15,DR.,ZACHARY,,SIMPSON,,M,3/26/1968,6446; Hunter Lights Brooks; Fitchburg&; <30074>; US
16,DR.,CHRISTINA,,BANKS,,F,7/25/1997,440; Robinson Village Hill; Acworth&; <30038>; US
17,MR.,TONY,,MILLER,,M,12/16/1956,82609; Michael Burgs Knoll; San Juan&; <30094>; US
18,MR.,BILLY,,ROBINSON,,M,4/19/1996,80929; Charles Mews Trail; Laguna Niguel&; <30099>; US
19,MS.,JENNA,,DIAZ,,F,03/08/1969,8716; Jenna Haven Corners; Murray&; <30074>; US
20,MRS.,ROBIN,,DAVIS,,F,03/12/1906,1487; Alicia Street Mission; Indio&; <30011>; US
21,MISS,ANA,,ORTIZ,,F,3/30/1960,2888; Huff Overpass Junction; Santa Maria&; <30001>; US
22,DR.,MARTIN,,LEE,,M,7/21/2001,267; Smith Field Islands; Leland&; <30031>; US
23,MRS.,LAURA,,ROBINSON,,F,03/05/1907,3814; Sanders Flat Vista; Kensington&; <30025>; US
24,DR.,HALEY,,STAFFORD,,F,12/08/2020,2540; Smith Walk Mountains; Far Rockaway&; <30048>; US
25,DR.,CHARLES,,BUTLER,,M,03/09/1935,5968; Scott Estates Isle; Sterling&; <30048>; US
26,MR.,PATRICK,,WILLIAMS,,M,02/09/1920,9192; Williams Field Island; Norwalk&; <30031>; US
27,MRS.,DONNA,,WARD,,F,5/31/1909,6455; Woodard Flat Lake; Glendale&; <30084>; US
28,DR.,CARLA,,HARRIS,,F,08/06/1937,56094; Kelly Center Valleys; Porterville&; <30060>; US
29,MRS.,TIFFANY,,COX,,F,03/01/1939,51894; Debra Dale Freeway; Fitchburg&; <30076>; US
30,MISS,JULIE,,JACOBSON,,F,12/31/2018,10215; Proctor Lakes Wall; Milledgeville&; <30015>; US
31,DR.,JORDAN,,MOORE,,M,04/03/1962,703; Frances Ways Manors; Pahrump&; <30058>; US
32,DR.,JOHN,,RICHARDSON,,M,12/19/1917,212; Jackson Stream Alley; Mechanicsville&; <30076>; US
33,MR.,TONY,,KRAMER,,M,1/22/1924,303; Adams Light Rest; Greenpoint&; <30051>; US
34,MRS.,JENNA,,HUDSON,,F,12/11/2000,287; Smith Roads Expressway; Bothell&; <30011>; US
35,DR.,SYLVIA,,BASS,,F,03/05/1921,631; Andrew Summit Dam; Columbia Heights&; <30067>; US
36,DR.,JODY,,MILLER,,F,08/10/1937,196; David Shoals Junction; Dumont&; <30026>; US
37,MRS.,SANDRA,,MITCHELL,,F,1/30/1977,6301; Michael Coves Street; Fresno&; <30077>; US
38,MR.,ALEJANDRO,,LOWE,,M,11/21/2019,68297; Austin Terrace Fields; Sicklerville&; <30066>; US
39,MRS.,STEPHANIE,,POPE,,F,12/11/1979,9868; Steven Loop Trail; Redding&; <30097>; US
40,DR.,AMBER,,GRAVES,,F,08/03/1947,1146; Zachary Place Corners; Morningside Heights&; <30044>; US
41,MR.,STEPHEN,,CONLEY,,M,3/23/1997,687; Hall Junctions Station; Tyler&; <30098>; US
42,DR.,AMANDA,,CONLEY,,F,10/01/1930,5113; David Vista Keys; Far Rockaway&; <30031>; US
43,MS.,JENNA,,CHOI,,F,12/21/1931,8515; Miller Bridge Pass; Longview&; <30064>; US
44,DR.,DAVID,,HARPER,,M,9/22/1913,5037; Kenneth Keys Causeway; Palestine&; <30091>; US
45,MR.,KEVIN,,HOWARD,,M,02/12/1925,33450; Amanda Highway Village; Independence&; <30081>; US
46,MRS.,CATHERINE,,MUELLER,,F,02/10/1943,583; Burke Port Groves; Fresno&; <30004>; US
47,DR.,MATTHEW,,PATTERSON,,M,12/30/1938,331; Rachel Knolls Walks; Kent&; <30047>; US
48,DR.,GARY,,JIMENEZ,,M,08/01/1938,40709; Jacqueline Points Shores; Grand Forks&; <30047>; US
49,MR.,JUSTIN,,MENDEZ,,M,12/29/1975,693; Martin Common Divide; Leland&; <30067>; US
50,DR.,RICHARD,,HAYNES,,M,10/25/1937,133; Smith Throughway Flat; Indio&; <30094>; US
51,MS.,KAREN,,AGUILAR,,F,07/02/1996,25518; Andrew Spring Shoals; Greenpoint&; <30048>; US
52,MR.,MARTIN,,MOORE,,M,10/26/1998,5611; Chan Street Square; Pottstown&; <30079>; US
53,DR.,SARA,,ROBINSON,,F,12/15/1927,9296; Mario Crest Coves; Estelle&; <30075>; US
54,MISS,AMANDA,,HOBBS,,F,8/18/2018,898; Christina Brook Plaza; Pahrump&; <30068>; US
55,DR.,MARY,,ZUNIGA,,F,2/26/1978,92383; Ramirez Lake Row; Evergreen Park&; <30082>; US
56,MR.,ISAIAH,,MANNING,,M,1/27/1967,8760; Garcia Forges Extensions; New City&; <30036>; US
57,MRS.,LAURA,,BRYANT,,F,2/15/1996,292; Brendan Freeway Glen; Santa Maria&; <30032>; US
58,DR.,MELISSA,,FREEMAN,,F,5/23/1984,4008; Crystal Parkways Island; Fayetteville&; <30043>; US
59,MISS,ALYSSA,,LEE,,F,3/14/1985,665; Michael Plain Mountains; Chillum&; <30089>; US
60,MR.,ISAIAH,,SOTO,,M,12/30/1977,34948; Charles Track Tunnel; Norco&; <30023>; US
61,MS.,LINDSAY,,HARRISON,,F,08/04/1969,297; Charles Flats Mission; North Lauderdale&; <30085>; US
62,MRS.,KATHERINE,,EVANS,,F,3/15/2001,691; Robin Ranch Drive; Davis&; <30061>; US
63,DR.,JEFFREY,,SMITH,,M,4/24/2012,41734; Rebecca Locks Street; Toledo&; <30099>; US
64,MR.,ANTHONY,,HILL,,M,06/05/1987,1551; Serrano Lodge Trace; Hueytown&; <30063>; US
65,MR.,BRIAN,,RODRIGUEZ,,M,8/25/1979,8767; Paul Turnpike Ranch; Rosedale&; <30016>; US
66,DR.,MICHELLE,,SPENCER,,F,03/07/2009,0; Wilson Rapid Meadow; Copperas Cove&; <30043>; US
67,MISS,AMANDA,,STRICKLAND,,F,7/24/1990,33122; Ashley Gateway Valley; Granger&; <30076>; US
68,MR.,PETER,,KNIGHT,,M,10/13/1986,91778; Blair Corners Circles; Bridgeport&; <30093>; US
69,MR.,THOMAS,,WILLIAMS,,M,05/08/1944,75691; Stanley Roads Hills; Encinitas&; <30016>; US
70,DR.,ROBERT,,CRUZ,,M,09/02/1966,193; Gentry Canyon Rest; Hutchinson&; <30023>; US
71,MRS.,CINDY,,DANIEL,,F,4/29/1967,17667; Karen Via Center; Glendale&; <30025>; US
72,MR.,JAMES,,DOMINGUEZ,,M,04/02/1973,82139; Harris Glens Flats; Lexington&; <30034>; US
73,DR.,SUSAN,,WOOD,,F,1/31/2006,868; Roth Manors Inlet; Boston&; <30020>; US
74,MRS.,MARGARET,,BROOKS,,F,12/20/1961,634; John Stravenue Grove; Yonkers&; <30003>; US
75,MS.,JO,,TURNER,,F,07/02/1917,371; Shane Cliff Lodge; Claremont&; <30083>; US
76,MISS,KIMBERLY,,HILL,,F,05/11/1907,42056; Yu Tunnel Mount; South Lawndale&; <30014>; US
77,MR.,MATTHEW,,WALSH,,M,11/03/1991,528; Kelly Parks Road; Mira Mesa&; <30095>; US
78,MR.,TRAVIS,,TURNER,,M,5/29/1990,606; Frederick Pass Loop; Deltona&; <30077>; US
79,DR.,MATTHEW,,MCDOWELL,,M,06/04/2005,9012; Crystal Trace Forest; Nampa&; <30006>; US
80,MS.,BARBARA,,JOHNSON,,F,12/15/1966,7624; Tara Forks Alley; Lower West Side&; <30064>; US
81,MR.,DAVID,,HOFFMAN,,M,7/30/1970,643; Ballard Motorway Row; Crystal Lake&; <30055>; US
82,MRS.,STEPHANIE,,HUNT,,F,6/13/1908,942; Hill Cliff Knolls; Pekin&; <30033>; US
83,MR.,DAVID,,NELSON,,M,6/18/1943,509; Carlos Tunnel River; Dumont&; <30054>; US
84,DR.,ANITA,,NUNEZ,,F,8/21/1929,78529; Ross Course Camp; Claremont&; <30096>; US
85,MR.,WILLIE,,MARTINEZ,,M,7/24/1912,26567; Sara Knolls Rue; South Lawndale&; <30071>; US
86,MRS.,AMANDA,,WILLIAMS,,F,01/05/1994,882; Heather Ramp Stravenue; Iron River&; <30016>; US
87,MR.,ADAM,,ANTHONY,,M,10/24/1934,65935; Theodore Shores Dam; Nampa&; <30006>; US
88,MRS.,BROOKE,,CLARK,,F,1/30/1910,2609; Casey Fort Place; Mechanicsville&; <30051>; US
89,DR.,VINCENT,,JOHNSON,,M,6/17/1941,26414; Taylor Highway Flats; South Whittier&; <30076>; US
90,MR.,MICHAEL,,NICHOLS,,M,01/10/1926,869; Ruth Mission Key; Keizer&; <30064>; US
91,MR.,DANIEL,,WRIGHT,,M,1/13/1940,320; Brown Dam Corner; Ken Caryl&; <30023>; US
92,MRS.,DAWN,,MCKENZIE,,F,2/23/1916,7177; John Street Tunnel; Sterling&; <30031>; US
93,MR.,KEITH,,HUGHES,,M,06/10/2015,46128; Quinn Freeway Manors; Columbia Heights&; <30021>; US
94,MRS.,SUSAN,,HERNANDEZ,,F,2/15/1931,635; Catherine Ramp Neck; Acworth&; <30097>; US
95,DR.,EMILY,,WATERS,,F,01/04/1931,576; Brian Shore Rue; Woodbridge&; <30003>; US
96,MR.,DOUGLAS,,MACDONALD,,M,12/29/2003,69679; Underwood Avenue Road; Deltona&; <30055>; US
97,MR.,ROBERT,,SMITH,,M,07/08/2002,40676; Alex Shore Junction; Keizer&; <30019>; US
98,MRS.,CHRISTINA,,EVANS,,F,07/03/1968,66945; Wright Cliff Wells; Aurora&; <30011>; US
99,MRS.,DIANE,,GARCIA,,F,11/26/1983,7901; Blevins Brooks Extensions; Scottsdale&; <30071>; US
100,MR.,ROBERT,,ROBERTS,,M,03/12/1939,50126; Williams Burgs Harbor; American Canyon&; <30064>; US
101,MRS.,JENNIFER,,MARTIN,,F,07/07/1968,2716; Leon Vista Terrace; Bourbonnais&; <30044>; US
102,MRS.,ALLISON,,LYNN,,F,10/08/1936,22316; Franco Glens Keys; Yonkers&; <30022>; US
103,DR.,JOHNNY,,WILLIAMS,,M,10/04/1907,40378; Elliott Via Fall; South Whittier&; <30036>; US
104,DR.,LAUREN,,WALKER,,F,11/26/1949,3376; Hall Dale Extension; Redding&; <30066>; US
105,MR.,DAVID,,ADAMS,,M,5/24/1967,9352; Rivera Island Loaf; Hueytown&; <30047>; US
106,MR.,JUSTIN,,CHAMBERS,,M,11/16/1912,38928; Jordan Plaza Fall; Clermont&; <30091>; US
107,MR.,JUSTIN,,PITTMAN,,M,06/09/1944,717; Joseph Course Harbor; Iron River&; <30008>; US
108,MR.,ADAM,,MEJIA,,M,5/16/1917,508; Allen Road Roads; Boston&; <30065>; US
109,MR.,ALAN,,PAGE,,M,04/02/1918,246; Oliver Way Walks; Davis&; <30019>; US
110,MRS.,VICTORIA,,BLACK,,F,02/01/1978,750; Michael Spurs Pine; Woodlawn&; <30075>; US
111,MISS,NICOLE,,RAMOS,,F,10/26/2019,4155; Patrick Causeway Harbors; Woodlawn&; <30082>; US
112,DR.,ANNA,,SMITH,,F,03/04/1907,87153; Matthew Mall Lodge; Gilbert&; <30067>; US
113,MR.,RONALD,,HIGGINS,,M,10/15/1982,30; Thompson Junction Camp; Lower West Side&; <30067>; US
114,DR.,ROBERT,,CRUZ,,M,02/12/1954,3290; Jerome Pass Hills; Shreveport&; <30027>; US
115,DR.,JUSTIN,,BURNS,,M,08/11/1956,663; Brown Corner Summit; Kearns&; <30059>; US
116,MRS.,MARIA,,QUINN,,F,2/23/1994,7157; Megan Squares Courts; Fresno&; <30023>; US
117,MS.,SHANNON,,WOODS,,F,5/19/1935,27415; Gregory Mount Heights; Gainesville&; <30094>; US
118,DR.,JENNIFER,,WILLIAMS,,F,3/31/1995,240; Adrienne Place Spurs; New Canaan&; <30055>; US
119,DR.,STEPHANIE,,ARMSTRONG,,F,8/16/1995,857; Barbara Rapids Forest; Carlsbad&; <30046>; US
120,MRS.,JOANNA,,ELLIOTT,,F,7/18/1933,24787; Valdez Knolls Village; East Haven&; <30020>; US
121,MR.,WESLEY,,CUNNINGHAM,,M,04/05/1913,61257; Megan Islands Ranch; Rosedale&; <30075>; US
122,DR.,JOSEPH,,SMITH,,M,9/17/1944,20556; Kevin Walk Manor; Morningside Heights&; <30070>; US
123,MS.,SARAH,,JONES,,F,10/26/1981,78539; Edwards Mission Divide; Beaumont&; <30068>; US
124,MR.,MICHAEL,,MARSH,,M,12/04/1994,1613; West Ranch Park; Palm Valley&; <30023>; US
125,MR.,JARED,,MILLER,,M,12/26/2010,6219; Jones Pike Garden; South Whittier&; <30067>; US
126,DR.,BRYAN,,LEE,,M,8/24/2003,47447; Cassie Union Rue; Camarillo&; <30084>; US
127,MR.,HAROLD,,LYNCH,,M,05/09/1917,2765; Reed Shoals Meadow; Peabody&; <30014>; US
128,MR.,LUKE,,BROOKS,,M,03/05/1923,2272; Brandon Dam Crossing; Waverly&; <30099>; US
129,MRS.,KATELYN,,WEBER,,F,10/01/1996,9499; Nash Wall Neck; Gilbert&; <30094>; US
130,MRS.,BARBARA,,BENDER,,F,4/16/1990,358; Sanchez Rapids Rue; Covington&; <30070>; US
131,MR.,DAVID,,STRONG,,M,05/07/1974,4665; Parker Villages Park; Sterling&; <30062>; US
132,DR.,ERIC,,BLACKBURN,,M,8/27/1960,567; Roberts Summit Estates; Clermont&; <30035>; US
133,MR.,MICHAEL,,PEREZ,,M,3/25/2015,978; Marie Junction Wells; Gainesville&; <30001>; US
134,MRS.,ANGELICA,,ELLIS,,F,2/26/1919,6719; Scott Locks Inlet; Punta Gorda Isles&; <30034>; US
135,DR.,JILL,,BUCK,,F,4/13/1929,1935; Ryan Valleys Mount; Venice&; <30058>; US
136,MRS.,PAIGE,,BROWN,,F,8/16/1969,1663; Harris Turnpike Shoal; Dublin&; <30027>; US
137,MR.,JOSEPH,,ANDERSON,,M,03/06/1975,78885; Jennifer Ramp Knolls; Massapequa&; <30050>; US
138,DR.,CRAIG,,SCHMIDT,,M,4/25/1953,746; Jennifer Extensions Avenue; Odessa&; <30063>; US
139,MRS.,ELIZABETH,,WATSON,,F,3/13/2002,3260; Rachel Extensions Hills; Pahrump&; <30011>; US
140,DR.,ALEXIS,,CAMPBELL,,F,7/27/1939,191; West Motorway Rapids; West Des Moines&; <30039>; US
141,MR.,JASON,,WARD,,M,2/27/1947,25824; Francisco Parkway Forges; Hutto&; <30031>; US
142,DR.,DANIEL,,HIGGINS,,M,04/06/1991,343; Schultz Corner Avenue; American Canyon&; <30050>; US
143,MR.,LONNIE,,LEE,,M,9/29/1968,16116; Carter Fall Roads; Bryn Mawr-Skyway&; <30036>; US
144,MR.,MARK,,JENKINS,,M,1/16/1910,891; Armstrong Ford Garden; Harrisburg&; <30042>; US
145,DR.,BRUCE,,RIVERA,,M,11/23/1912,8809; Antonio Drive Falls; Covington&; <30008>; US
146,MRS.,BONNIE,,MATA,,F,9/13/1906,6589; Richard Mount Extension; Hutto&; <30001>; US
147,DR.,CHEYENNE,,HENRY,,F,10/08/1939,3658; Robyn Overpass Spur; Kendall&; <30013>; US
148,DR.,CONNOR,,TYLER,,M,12/04/2000,60; Wilson Centers Spring; Scottsdale&; <30003>; US
149,DR.,THOMAS,,WHITE,,M,8/17/1907,30626; Deborah Ferry Turnpike; Opportunity&; <30009>; US
150,MRS.,SUZANNE,,JOHNSON,,F,6/19/1947,24745; Melissa Curve Union; South Whittier&; <30014>; US
151,DR.,JOHN,,JONES,,M,12/04/1986,46126; Robbins Viaduct Brooks; Hutchinson&; <30007>; US
152,MR.,DAVID,,GARCIA,,M,4/16/1997,65554; Gilbert Port Lodge; Tyler&; <30008>; US
153,MR.,JOSEPH,,COOLEY,,M,11/13/1905,7033; Galloway Alley Ford; Middletown&; <30028>; US
154,DR.,SHERRI,,HOWARD,,F,7/29/1954,2064; Joshua Junctions Walks; Rutland&; <30063>; US
155,MRS.,DEBRA,,MAXWELL,,F,03/11/1958,85597; Ryan Island Spring; Brenham&; <30058>; US
156,DR.,PETER,,GREEN,,M,12/13/2001,6253; Amy Point Station; Brentwood Estates&; <30051>; US
157,MR.,RICHARD,,ASHLEY,,M,10/02/1922,729; Brian Village Radial; Carlsbad&; <30011>; US
158,DR.,MATTHEW,,VILLEGAS,,M,08/08/1949,59804; Jennifer Common Passage; Cypress Hills&; <30092>; US
159,DR.,CHARLES,,BRYANT,,M,5/21/1958,326; David Ramp Cliffs; Greenfield&; <30009>; US
160,MR.,SCOTT,,TYLER,,M,9/28/1959,489; Maria Stravenue Stream; Keene&; <30073>; US
161,MISS,VALERIE,,STONE,,F,9/16/1921,85658; Bryant Ridge Ford; West Chester&; <30098>; US
162,MRS.,VANESSA,,SULLIVAN,,F,01/02/1914,35614; Jasmine Lake Mission; Carlsbad&; <30069>; US
163,MR.,DAVID,,EDWARDS,,M,10/06/1939,299; Reed Station Drives; Greenville&; <30018>; US
164,MS.,PAMELA,,JOHNSON,,F,08/11/1943,574; Sheila Center Hollow; Kahului&; <30064>; US
165,MRS.,TERESA,,HUBBARD,,F,05/10/2001,65485; Kim Islands Hollow; Gainesville&; <30070>; US
166,MR.,ERIC,,ELLIS,,M,10/19/2009,78119; Robert Drive Fields; Acworth&; <30069>; US
167,MR.,THOMAS,,WILLIAMS,,M,12/27/2005,5; Erika Passage Track; Estelle&; <30003>; US
168,DR.,JAMES,,CORTEZ,,M,01/01/2003,193; Perez Rue Harbors; Shreveport&; <30005>; US
169,MR.,PAUL,,HUMPHREY,,M,5/19/1988,180; Kirsten Crest Track; Odessa&; <30036>; US
170,MR.,BRIAN,,CASTRO,,M,12/09/1908,84874; Michelle Cove Prairie; Crystal Lake&; <30076>; US
171,DR.,MICHAEL,,REESE,,M,9/26/1951,8551; Christopher Via Shoal; Fort Washington&; <30004>; US
172,MISS,JULIE,,JOHNSON,,F,6/30/1960,21827; Young Motorway Haven; Acworth&; <30043>; US
173,MR.,DAVID,,FREEMAN,,M,3/19/1984,188; Steven Loaf Streets; Kent&; <30020>; US
174,MRS.,SUSAN,,PARSONS,,F,04/08/1970,652; Wood Meadows Trail; Clermont&; <30037>; US
175,DR.,CARLOS,,MENDOZA,,M,8/24/1933,57305; Sandra Rapid Squares; Dublin&; <30028>; US
176,MR.,JUAN,,PAYNE,,M,10/30/1945,211; Moore Square Camp; Boston&; <30052>; US
177,MS.,ELIZABETH,,HERNANDEZ,,F,01/04/1915,199; Austin Glens Trail; Vestavia Hills&; <30099>; US
178,DR.,DAVID,,VINCENT,,M,08/06/1944,17915; Jennifer Camp Spring; Mechanicsville&; <30099>; US
179,DR.,ROBIN,,LIU,,F,03/06/1936,4899; Martin Landing Islands; Tupelo&; <30089>; US
180,MRS.,SAVANNAH,,JOHNSON,,F,2/19/1923,2901; Harrington Vista Neck; Lebanon&; <30082>; US
181,MS.,BRENDA,,WEST,,F,09/01/1948,930; Carl Circle Divide; Malden&; <30087>; US
182,MRS.,ERIN,,CLARK,,F,1/15/1998,47180; Moore Squares Manors; Keene&; <30063>; US
183,MS.,ERICA,,FORD,,F,09/05/2007,43; Heather River Mills; Abilene&; <30033>; US
184,MISS,TINA,,GOODMAN,,F,6/26/1984,248; Julie Estates Squares; Gates-North Gates&; <30015>; US
185,MRS.,DEBORAH,,BLACK,,F,9/20/1980,7483; Lee Inlet Views; Camarillo&; <30017>; US
186,MR.,PATRICK,,JOHNSON,,M,9/16/1942,5031; Burke Inlet Summit; Keene&; <30072>; US
187,MR.,THOMAS,,SANCHEZ,,M,3/29/1927,682; Hernandez Brook Rue; Lower West Side&; <30025>; US
188,MRS.,ASHLEY,,MORALES,,F,01/05/1979,44267; Armstrong Pines Radial; Nampa&; <30015>; US
189,MR.,STEVEN,,STONE,,M,8/14/1987,393; Ashley Mountains Via; Middletown&; <30008>; US
190,DR.,ALLEN,,VANG,,M,03/05/2005,207; Emily Roads Pines; Harrisburg&; <30056>; US
191,DR.,JENNIFER,,TURNER,,F,04/11/1986,1; Peterson Common Flats; Davis&; <30088>; US
192,MRS.,SUSAN,,VALENTINE,,F,02/03/1978,81699; Dawn Run Land; Huntley&; <30044>; US
193,MR.,ROBERT,,GONZALEZ,,M,3/13/1995,52751; Jacobson Ways Rest; Searcy&; <30027>; US
194,MRS.,DONNA,,MURRAY,,F,10/18/2000,3206; Hill Courts Station; Scottsdale&; <30059>; US
195,MRS.,JENNIFER,,LE,,F,6/25/1918,5542; Glenn Crossing Islands; Muskogee&; <30082>; US
196,DR.,LAURA,,SMITH,,F,10/04/1990,86; James Plaza Mission; Troutdale&; <30029>; US
197,MR.,MICHAEL,,CRUZ,,M,11/09/1975,1019; Ruiz Field Garden; Milledgeville&; <30044>; US
198,MISS,LAURA,,GRANT,,F,8/24/1905,710; Hayes Views Wells; Ken Caryl&; <30044>; US
199,DR.,AMANDA,,SMITH,,F,1/29/1994,76908; Walker Springs Drive; Chillum&; <30080>; US
200,DR.,LONNIE,,ROBERTS,,M,9/25/1982,267; Danielle Run Ramp; North Tustin&; <30058>; US
201,DR.,STEPHEN,,PARSONS,,M,8/16/2017,114; Cameron Islands Key; Gates-North Gates&; <30034>; US
202,MR.,WILLIAM,,WRIGHT,,M,09/09/1926,6522; Rodriguez Gateway Wall; East Haven&; <30005>; US
203,MR.,JAMES,,CRUZ,,M,10/21/2002,89752; Sullivan Corner Roads; Tyler&; <30068>; US
204,DR.,JEFFERY,,SANTOS,,M,5/29/1985,3862; Williamson Heights Hills; Visitacion Valley&; <30014>; US
205,DR.,PAULA,,WILSON,,F,1/29/1922,18863; Michele Lake Harbor; Norco&; <30056>; US
206,MR.,JOHN,,CARROLL,,M,1/25/1987,69; Jones Glens Brooks; Aurora&; <30048>; US
207,MRS.,JENNIFER,,GILMORE,,F,06/10/1907,95464; Kathy Forges Camp; Scotch Plains&; <30021>; US
208,MRS.,MARILYN,,JEFFERSON,,F,04/01/1912,86041; Justin Stravenue Lock; New City&; <30042>; US
209,MR.,GILBERT,,HURLEY,,M,03/11/1941,249; Eric Passage Creek; Front Royal&; <30017>; US
210,MISS,MARY,,ORTEGA,,F,6/16/1989,18443; Curtis Vista River; Keizer&; <30027>; US
211,MRS.,TAMMY,,LUNA,,F,4/24/1931,56331; Michael Well Garden; Scotch Plains&; <30087>; US
212,DR.,RYAN,,MARTIN,,M,11/02/1991,531; Michael Greens Vista; Schererville&; <30012>; US
213,MR.,JOSEPH,,RAMIREZ,,M,08/11/1970,941; Allen Overpass Centers; San Juan&; <30040>; US
214,MRS.,CHLOE,,LONG,,F,8/30/2008,3127; Soto Prairie Islands; Brenham&; <30077>; US
215,MRS.,SUZANNE,,JONES,,F,01/09/1932,19906; Hall Lane Street; Crystal Lake&; <30080>; US
216,MRS.,NICOLE,,LOPEZ,,F,10/11/2014,6707; Dunn Lake Terrace; Middletown&; <30083>; US
217,MR.,WILLIAM,,SWEENEY,,M,11/11/1915,927; Thompson Fall Place; Fitchburg&; <30033>; US
218,MRS.,WENDY,,CURTIS,,F,06/02/1987,910; Cruz Ways Square; Cypress Hills&; <30059>; US
219,DR.,JOHN,,LEE,,M,04/04/1918,6132; Miller Track Vista; Scottsdale&; <30056>; US
220,MRS.,YVONNE,,WALKER,,F,5/14/2001,7144; Gray Flat Inlet; Scarsdale&; <30071>; US
221,MRS.,TAMMIE,,SPENCER,,F,7/22/1953,95649; Oconnor Village Extension; Westchester&; <30095>; US
222,DR.,CATHERINE,,OWENS,,F,5/31/1930,7819; Case Causeway Crossing; Far Rockaway&; <30085>; US
223,MR.,MAURICE,,VILLA,,M,10/26/1991,85106; Hannah Passage Fork; Claremont&; <30006>; US
224,DR.,REBECCA,,SANDERS,,F,12/24/1961,8732; Adam Port Gateway; East Haven&; <30078>; US
225,MRS.,CAROLYN,,MOODY,,F,2/16/1938,4439; Phillips Stream Underpass; Kensington&; <30003>; US
226,MS.,MARIAH,,MYERS,,F,8/16/1912,67027; Deborah Plaza Trace; Cypress Hills&; <30065>; US
227,MISS,CHRISTINE,,MOORE,,F,7/28/1924,61244; Shelton Fort Ports; Waverly&; <30062>; US
228,MS.,CHRISTINA,,JACKSON,,F,9/16/1944,281; Caldwell Center Brooks; Cypress Hills&; <30046>; US
229,MR.,HENRY,,CLAY,,M,12/10/1991,69814; Amy Path Light; Canton&; <30061>; US
230,MR.,ROBERT,,LAWSON,,M,12/24/1998,41046; Brittany Fall Locks; San Gabriel&; <30028>; US
231,MR.,MICHAEL,,AGUIRRE,,M,10/27/2019,115; Parsons Knoll Way; East Haven&; <30074>; US
232,MRS.,NATALIE,,SANCHEZ,,F,2/21/1968,53123; Dylan Shoals Gateway; Pottstown&; <30081>; US
233,MR.,JOSEPH,,STUART,,M,2/29/1988,16881; Wilson Trafficway Shoals; Jersey City&; <30018>; US
234,DR.,WILLIAM,,DAVIS,,M,5/24/1937,98; Thomas Extension Shore; Jackson&; <30082>; US
235,MISS,NORMA,,PATTERSON,,F,12/02/1931,68208; Carolyn Street Camp; Woodlawn&; <30066>; US
236,MISS,JACQUELINE,,SEXTON,,F,06/02/1983,51393; Dawn Loaf Unions; San Gabriel&; <30092>; US
237,DR.,JAMES,,TORRES,,M,3/30/1972,8090; Ramos Plains Rapid; Brenham&; <30035>; US
238,MRS.,JULIA,,JOHNSON,,F,2/18/1985,4050; Jensen Rapid Ridges; Gates-North Gates&; <30048>; US
239,MR.,DONALD,,KELLER,,M,11/28/2005,996; Hoover Shore Camp; Sicklerville&; <30053>; US
240,MS.,JENNIFER,,DAVIS,,F,4/27/1930,31721; Mitchell Parkway Drives; Rolla&; <30045>; US
241,DR.,AMY,,STEWART,,F,05/12/1976,80477; Emily Mountains Plains; Greenpoint&; <30033>; US
242,MR.,DENNIS,,WAGNER,,M,06/02/1905,814; Day Hills Vista; Visitacion Valley&; <30020>; US
243,DR.,BETTY,,RAMIREZ,,F,3/19/1929,4670; Phillips Flat Station; Fitchburg&; <30030>; US
244,MRS.,BRENDA,,COLLINS,,F,07/06/1908,6211; Holland Crossroad Cape; Middletown&; <30008>; US
245,DR.,SHAWN,,RODRIGUEZ,,M,11/19/1978,23; Brandon Shoal Forge; Brunswick&; <30069>; US
246,DR.,SHARON,,GAINES,,F,6/14/1979,4003; Anderson Cove Knoll; Brenham&; <30037>; US
247,MR.,JUSTIN,,ROGERS,,M,12/03/1958,466; Kenneth Center Parks; Peabody&; <30045>; US
248,MR.,MICHAEL,,HAMMOND,,M,02/07/2011,85394; Sharon Plain Rapids; Covington&; <30032>; US
249,MRS.,ELLEN,,LAMB,,F,01/02/1993,786; Graves Greens Forks; Davis&; <30095>; US
250,MR.,KEVIN,,WILLIAMS,,M,1/16/2018,186; Barnett Shoal Mountain; Clermont&; <30099>; US
251,MRS.,KATHERINE,,TAYLOR,,F,9/14/1959,603; Powell Point Street; Scarsdale&; <30084>; US
252,MR.,CARLOS,,ELLIS,,M,10/05/1922,9996; Thomas Cove Park; Bridgeport&; <30023>; US
253,DR.,BRENDA,,HARRIS,,F,10/23/1917,6491; Martinez Rapid Isle; San Gabriel&; <30054>; US
254,DR.,SETH,,GONZALEZ,,M,06/04/1944,926; James Stravenue Ports; Aurora&; <30037>; US
255,MR.,JAMES,,HOUSTON,,M,4/25/1917,62041; Humphrey Gateway Extensions; Rolla&; <30016>; US
256,DR.,KAREN,,ADAMS,,F,03/07/2017,9055; Carpenter Via Spurs; Waterbury&; <30058>; US
257,MRS.,JANET,,MELENDEZ,,F,12/31/1998,78788; Lauren Ranch Mountain; Massapequa&; <30049>; US
258,DR.,KELLY,,TRAN,,F,11/18/1932,4925; Richardson Hollow Cove; Abilene&; <30035>; US
259,MR.,ANDREW,,GOMEZ,,M,09/12/1966,85413; Mark Courts Branch; Brentwood Estates&; <30051>; US
260,MS.,ALLISON,,MARQUEZ,,F,01/10/1943,46312; Castillo Oval Falls; Sunnyside&; <30070>; US
261,MR.,JONATHAN,,MORROW,,M,7/24/1959,43046; Robbins Row Islands; Bothell&; <30017>; US
262,DR.,JAMES,,POLLARD,,M,12/05/1973,509; Contreras Trail Village; Pahrump&; <30075>; US
263,MR.,BRIAN,,GARCIA,,M,4/28/2010,923; Hinton Passage Drive; American Canyon&; <30073>; US
264,DR.,RICHARD,,FISHER,,M,4/20/2010,7350; Charles Canyon Drive; Scotch Plains&; <30062>; US
265,DR.,WILLIAM,,CARROLL,,M,6/20/1955,47251; Allen Brook Forks; Sterling&; <30032>; US
266,MR.,TRACY,,JONES,,M,7/26/1997,61400; Dennis Common Hills; Nampa&; <30020>; US
267,MRS.,JENNIFER,,SHEPHERD,,F,4/16/1955,4693; Robert Lodge Station; Malden&; <30060>; US
268,MRS.,CHRISTINA,,WILSON,,F,3/25/1960,45376; Brown Corner Summit; Watsonville&; <30034>; US
269,MR.,THOMAS,,GLENN,,M,11/11/1942,786; Blake Court Rapid; Taunton&; <30022>; US
270,MR.,JASON,,BALDWIN,,M,5/28/1940,2629; Jeffrey Islands Knoll; Brunswick&; <30022>; US
271,DR.,BRIAN,,ROBINSON,,M,8/29/1916,81173; Oconnell Islands Dale; East Haven&; <30070>; US
272,DR.,RYAN,,RODRIGUEZ,,M,02/01/1944,8729; Horne Square Station; Kent&; <30085>; US
273,MRS.,CLAUDIA,,JUAREZ,,F,5/21/1947,103; Green Via Rapids; Rolla&; <30023>; US
274,MRS.,ANN,,PARK,,F,5/18/1912,5552; Carrie Knolls Station; Lompoc&; <30098>; US
275,MRS.,KIMBERLY,,MARTIN,,F,11/26/1948,733; Philip Cliff Court; Harrisburg&; <30084>; US
276,DR.,MISTY,,BAKER,,F,07/12/1928,466; Johnathan Walks Course; Acworth&; <30062>; US
277,MR.,RYAN,,GUERRERO,,M,04/10/1927,892; Price Ranch Inlet; Gilbert&; <30065>; US
278,DR.,ERIC,,WALTON,,M,7/22/1999,70475; James Bypass Canyon; Venice&; <30077>; US
279,MRS.,TIFFANY,,ESCOBAR,,F,01/01/2012,3492; Jennifer Inlet Garden; Palm Valley&; <30046>; US
280,MRS.,EMILY,,STEVENS,,F,04/11/2005,4071; Thomas Square Knoll; Pahrump&; <30007>; US
281,DR.,DIANE,,LEVINE,,F,10/02/1957,7228; Baldwin Ports Plaza; Sicklerville&; <30029>; US
282,DR.,VICTORIA,,NGUYEN,,F,4/19/2016,3900; Alexander Lakes Loop; Rolla&; <30075>; US
283,MR.,JAMES,,SIMS,,M,6/25/1929,78488; Dyer Radial Rest; Collinwood&; <30028>; US
284,MR.,MATTHEW,,DAVIS,,M,09/09/1919,759; Carr Motorway Gardens; Saratoga Springs&; <30086>; US
285,MR.,JOEL,,ROBERTSON,,M,4/29/1960,4404; Michael Lock Prairie; Saratoga Springs&; <30036>; US
286,DR.,BRIANNA,,WEBER,,F,4/16/1976,555; Tyler Viaduct Port; Muskogee&; <30037>; US
287,DR.,AMY,,ROBERTS,,F,11/17/2008,66900; Jennifer Pass Squares; Gainesville&; <30071>; US
288,MRS.,TANYA,,HOOPER,,F,01/04/1933,710; Smith Drive Drives; Lebanon&; <30043>; US
289,MRS.,JANET,,KNIGHT,,F,12/05/1909,1021; Garcia Roads Fort; Chillum&; <30059>; US
290,DR.,TODD,,CANTRELL,,M,03/11/2019,4042; John Grove Mission; Rutland&; <30006>; US
291,MRS.,LINDA,,AGUILAR,,F,5/28/1954,8536; Rachel Roads Plains; Boston&; <30040>; US
