Customer_ID,Prefix,First_Name,Middle_Name,Last_Name,Suffix,Gender,DoB,Address
870,DR.,GREGORY,,GRAY,,M,11/16/1970,4742; Saunders Underpass Park; Watsonville&; <30034>; US
871,MR.,MATTHEW,,HUNT,,M,05/01/1963,9380; Mills Camp Grove; Hutto&; <30085>; US
872,DR.,TIMOTHY,,MARTIN,,M,3/23/1928,72082; Goodwin Square Neck; Odessa&; <30061>; US
873,MS.,KELLY,,BAILEY,,F,10/16/1964,3540; Douglas Mall Oval; Vestavia Hills&; <30078>; US
874,MR.,ROBERT,,COOPER,,M,8/15/1923,2691; Mcguire Ranch Keys; Fort Washington&; <30052>; US
875,MRS.,ERIKA,,RODRIGUEZ,,F,1/31/1940,38119; Jones Harbor Gardens; Hutchinson&; <30058>; US
876,DR.,RICHARD,,VEGA,,M,01/10/1916,602; Diaz Ridge Bridge; Coralville&; <30081>; US
877,MR.,SHAWN,,TATE,,M,10/28/1957,2117; Allison Crescent Harbor; Searcy&; <30002>; US
878,DR.,KATHRYN,,PETTY,,F,8/15/1922,41; Moody Gardens Harbor; New Canaan&; <30001>; US
879,MR.,RYAN,,WHITE,,M,10/31/1928,33; Lambert Dam Shore; South Whittier&; <30013>; US
880,MR.,CASEY,,ROBERTS,,M,11/21/1934,6248; Arnold Circle Heights; Sicklerville&; <30045>; US
881,MR.,CHRISTOPHER,,DELGADO,,M,2/25/2002,74; Joseph Springs Mountains; West Des Moines&; <30075>; US
882,DR.,JENNIFER,,SMITH,,F,11/27/2011,8397; Mclaughlin Isle Meadow; Greenville&; <30050>; US
883,MS.,CHRISTINA,,GUERRERO,,F,12/10/1998,9075; Harry Fort Forks; Stockbridge&; <30022>; US
884,DR.,SHAWN,,BARNETT,,M,04/10/2010,1456; Mcdonald Island Village; Kahului&; <30046>; US
885,MR.,JULIAN,,BAKER,,M,03/11/1993,290; Katherine Plains Forest; Independence&; <30097>; US
886,DR.,MISTY,,CLARK,,F,3/13/1943,358; Lisa Ville Estate; Kendall&; <30086>; US
887,MR.,DERRICK,,RYAN,,M,11/01/1973,73587; Clark Extensions Terrace; Bryn Mawr-Skyway&; <30032>; US
888,MR.,DYLAN,,HUDSON,,M,12/09/2009,60607; Smith Isle Fort; Bon Air&; <30046>; US
889,MR.,GEORGE,,TAYLOR,,M,1/17/1956,981; Andrew Corners Islands; Punta Gorda Isles&; <30045>; US
890,MRS.,BRENDA,,JENKINS,,F,8/16/1984,370; Beverly Hollow Cliffs; West Chester&; <30061>; US
891,DR.,STEFANIE,,MCKAY,,F,9/15/1925,40018; Paula Fall Creek; Peabody&; <30004>; US
892,MRS.,ASHLEY,,ELLIS,,F,11/23/1967,3418; Chelsea Shoal Street; Yonkers&; <30049>; US
893,MR.,HARRY,,JOHNSON,,M,9/30/1928,840; Perkins Mill Pass; Brunswick&; <30021>; US
894,MR.,NICHOLAS,,LEE,,M,1/13/1965,42124; Tina Flat Prairie; Shreveport&; <30051>; US
895,MRS.,MEGAN,,SHAFFER,,F,10/09/1907,437; Thompson Stravenue Villages; Fort Washington&; <30011>; US
896,MR.,KYLE,,WALTERS,,M,2/19/1995,48306; Cobb Cape Inlet; Fitchburg&; <30008>; US
897,MRS.,ALLISON,,CAMPBELL,,F,07/12/1997,7019; Velazquez Crest Extension; Pahrump&; <30034>; US
898,DR.,JOSEPH,,BROWN,,M,3/18/1915,8999; Hood Tunnel Square; Fayetteville&; <30052>; US
899,MR.,DUSTIN,,MILLER,,M,04/12/1909,62936; Karen Ports Cape; Columbia Heights&; <30012>; US
900,MS.,AMANDA,,FISHER,,F,01/12/1986,9940; Ricky Via View; Sun City Center&; <30006>; US
901,DR.,BILLY,,JOHNSON,,M,4/30/1980,1214; Julie Union Ports; Punta Gorda Isles&; <30044>; US
902,MR.,MICHAEL,,CARTER,,M,03/05/1941,947; Robert Bypass Centers; Greenpoint&; <30080>; US
903,MISS,CHRISTINA,,WALTERS,,F,8/17/2010,62725; Michael Lodge Forks; Harrisburg&; <30053>; US
904,MR.,JOSE,,CALDERON,,M,09/11/1961,487; Barbara Harbors Trail; Pahrump&; <30008>; US
905,MRS.,LISA,,BRYANT,,F,12/21/1914,783; Ramirez Summit Spurs; American Canyon&; <30069>; US
906,MRS.,EMILY,,HILL,,F,08/05/2008,2196; Macdonald Isle Locks; Odessa&; <30091>; US
907,MR.,JOSHUA,,HUANG,,M,12/25/2012,85176; Paul Port Ranch; Clermont&; <30092>; US
908,DR.,WILLIAM,,DENNIS,,M,7/19/1963,318; Richard Circles Route; Vestavia Hills&; <30076>; US
909,MR.,KEVIN,,COBB,,M,7/16/2016,24227; Melanie Summit Ranch; Copperas Cove&; <30089>; US
910,DR.,DYLAN,,JACKSON,,M,03/12/1908,955; Chambers Lock Gateway; Bridgeport&; <30064>; US
911,MRS.,KARI,,ROBBINS,,F,1/24/2018,0; Mark Inlet Valley; Utica&; <30029>; US
912,MR.,BRANDON,,NIELSEN,,M,7/25/1966,32; Amanda Knoll Viaduct; North Lauderdale&; <30001>; US
913,DR.,DIANE,,HUERTA,,F,11/21/1959,372; Watson Fields Circles; Middle River&; <30081>; US
914,DR.,JOHN,,BAILEY,,M,3/30/2003,69366; Carney Village Prairie; Leland&; <30001>; US
915,MRS.,WENDY,,MILLER,,F,07/09/1973,94068; Kimberly Dam Gardens; Muskogee&; <30061>; US
916,MR.,JERRY,,BRIDGES,,M,9/24/1976,938; Rivers Ranch Walks; Canton&; <30089>; US
917,MR.,BRIAN,,BARBER,,M,08/06/1938,943; Steven Parkways Roads; Shreveport&; <30067>; US
918,MR.,MARC,,WILLIAMS,,M,12/13/1973,22175; Johnson Plaza Ferry; Granger&; <30049>; US
919,MRS.,PEGGY,,THOMAS,,F,5/17/1930,57201; Copeland Walk Lodge; Palm Desert&; <30044>; US
920,MR.,ROBERT,,MARTIN,,M,11/28/1910,633; Brooks Village Throughway; Malden&; <30058>; US
921,DR.,GABRIELLA,,HOOD,,F,08/12/1905,25272; Jackson Point Trafficway; Fitchburg&; <30042>; US
922,MR.,BRANDON,,CARDENAS,,M,02/03/1967,489; Harmon Well Crossroad; Thomasville&; <30057>; US
923,MR.,RICHARD,,HUGHES,,M,07/10/1945,404; Foster Mountains Circle; Leland&; <30010>; US
924,MR.,JAMES,,LOPEZ,,M,7/16/2006,440; Mcclure Circles Springs; Beaumont&; <30031>; US
925,DR.,JOEL,,HENDERSON,,M,07/12/1924,644; Beasley Cove Estates; Martinsburg&; <30095>; US
926,DR.,CARRIE,,ORTIZ,,F,6/29/1973,8911; Smith Mill Ferry; Carlsbad&; <30038>; US
927,DR.,LUCAS,,GARDNER,,M,05/07/1965,41844; Thompson Streets Highway; Greenville&; <30043>; US
928,MR.,SHANE,,CUNNINGHAM,,M,10/08/2005,8336; Courtney Extensions Fields; Stockbridge&; <30077>; US
929,MRS.,ISABELLA,,FLEMING,,F,12/09/1978,82675; Johnson Fields Gateway; Hutto&; <30087>; US
930,MRS.,AUTUMN,,CASTILLO,,F,12/27/2003,846; Javier Pass Rapids; Leland&; <30035>; US
931,MR.,JOSEPH,,JOHNSON,,M,4/18/2017,13726; Bishop Rest Prairie; Gates-North Gates&; <30004>; US
932,MR.,JAMIE,,BAILEY,,M,07/06/1983,395; Angelica Parkway Rapid; Waterbury&; <30032>; US
933,MR.,JOSHUA,,MURRAY,,M,11/13/1956,649; Smith Plaza Burg; Greenfield&; <30085>; US
934,DR.,ANTHONY,,LARSEN,,M,11/23/1911,1943; Diaz Road Circle; West Des Moines&; <30012>; US
935,MRS.,DIANE,,FIGUEROA,,F,3/25/1943,6390; Mcintosh River Harbors; Kearns&; <30074>; US
936,MRS.,LISA,,MCLEAN,,F,10/17/1996,4549; Benson Brook Squares; Mira Mesa&; <30087>; US
937,MR.,PATRICK,,RICHARDSON,,M,10/13/1951,568; Bowers Walks Point; Utica&; <30048>; US
938,DR.,RANDALL,,RICHARDSON,,M,12/06/1971,37118; Barbara Overpass Club; Greenville&; <30072>; US
939,MR.,KENNETH,,DOMINGUEZ,,M,02/12/1953,797; Katherine Forges Fall; Longview&; <30031>; US
940,MRS.,MELISSA,,ROBINSON,,F,03/12/2000,53343; Hernandez Pine Hills; Mechanicsville&; <30073>; US
941,MR.,PAUL,,PHAM,,M,08/06/1914,758; Woods Shores Flat; Gates-North Gates&; <30013>; US
942,MRS.,SARA,,SMITH,,F,06/04/1982,76331; Carter Manors Parks; Watsonville&; <30038>; US
943,MISS,KRISTEN,,LAWSON,,F,06/11/1956,6663; Steve Loaf Forest; Gates-North Gates&; <30076>; US
944,MISS,ANGELA,,RODRIGUEZ,,F,3/21/1914,2145; Pamela Freeway Stream; Fitchburg&; <30093>; US
945,MRS.,BAILEY,,FREEMAN,,F,6/27/1973,622; Singh Loaf Island; Glendale&; <30094>; US
946,MRS.,ASHLEY,,WALKER,,F,12/23/1989,849; Michael Terrace Bypass; Sterling&; <30021>; US
947,DR.,ERIC,,FORD,,M,10/14/2004,42270; Ortiz Square Cliff; Toledo&; <30050>; US
948,DR.,MICHAEL,,WATSON,,M,11/14/1941,579; Victor Dale Extensions; Lutz&; <30065>; US
949,MR.,SCOTT,,BECKER,,M,04/12/1998,9892; Harris Lakes Ports; Pekin&; <30040>; US
950,DR.,LESLIE,,JOHNSON,,F,09/11/1979,43973; Taylor Square Viaduct; Brighton Beach&; <30064>; US
951,MR.,CRAIG,,BUTLER,,M,10/30/1970,2988; Jose Mountain Shores; Thomasville&; <30031>; US
952,MRS.,JULIE,,MCDONALD,,F,04/12/1951,6148; Brown Loop Skyway; East Haven&; <30056>; US
953,DR.,DANIEL,,SMITH,,M,11/06/1959,4268; Jose Turnpike Lane; Tyler&; <30087>; US
954,MRS.,KIRSTEN,,GREEN,,F,12/16/1907,6570; Hamilton Light Mills; Fayetteville&; <30076>; US
955,DR.,EMILY,,CASEY,,F,10/25/1943,853; Nielsen Walk Camp; Venice&; <30047>; US
956,MRS.,BRANDY,,SHANNON,,F,05/09/1966,366; Dustin Street Trail; Kahului&; <30046>; US
957,MISS,KELLY,,ALVARADO,,F,06/10/1934,41765; Smith Walk Ville; Woodlawn&; <30071>; US
958,MRS.,AMANDA,,GREEN,,F,10/21/1985,94115; Lewis Flats Rest; Yonkers&; <30099>; US
959,DR.,HEATHER,,REEVES,,F,10/06/1934,219; Collier Shores Station; Murray&; <30074>; US
960,DR.,JACKSON,,ENGLISH,,M,4/22/1999,75806; Matthew Orchard Estate; Tupelo&; <30030>; US
961,DR.,NICHOLAS,,FREEMAN,,M,3/17/1926,70; Matthew Ports Mills; Acworth&; <30031>; US
962,DR.,DANA,,LEWIS,,F,7/16/1925,214; Brian Squares Expressway; Lompoc&; <30081>; US
963,DR.,WHITNEY,,MCDONALD,,F,05/11/1983,47768; Gabriel Mountains Parkways; Bothell&; <30027>; US
964,MR.,DANIEL,,KING,,M,10/12/1951,3675; Walker Ports Mall; Malden&; <30034>; US
965,DR.,CODY,,GRAVES,,M,12/09/2003,74911; Bell Wall Streets; Westchester&; <30017>; US
966,MR.,JOSEPH,,HOWARD,,M,10/15/1934,457; Dixon Wall Field; Port Huron&; <30045>; US
967,MRS.,JAMIE,,HENDERSON,,F,7/20/1948,4892; Ramirez Ferry Shore; Peabody&; <30057>; US
968,MRS.,BRITTANY,,VASQUEZ,,F,12/12/1940,379; Gary Stream Drive; West Chester&; <30012>; US
969,DR.,ALEXANDER,,WATTS,,M,8/25/1974,3759; Joshua Lodge Stream; Brunswick&; <30098>; US
970,DR.,JOHN,,GORDON,,M,9/30/1956,511; Hoover Inlet Wall; Nampa&; <30018>; US
971,DR.,TYLER,,TORRES,,M,05/05/1923,648; Kyle Neck Club; Mechanicsville&; <30012>; US
972,MS.,JENNIFER,,COX,,F,07/01/2015,232; Kimberly Street Ports; Brunswick&; <30057>; US
973,MRS.,MARIA,,GRIFFITH,,F,3/26/1991,693; Bowers Dam Lights; Tupelo&; <30032>; US
974,MR.,TRAVIS,,JOHNSON,,M,5/31/1969,7497; Chavez Lodge Forest; Middle River&; <30071>; US
975,DR.,JESSICA,,MILLER,,F,07/04/1912,9003; Andrews Road Spurs; Greenville&; <30071>; US
976,MRS.,KIMBERLY,,NORTON,,F,12/20/1977,624; John Drive Street; Norwalk&; <30064>; US
977,DR.,KELLI,,WILCOX,,F,1/24/1911,163; White Turnpike Squares; Kaukauna&; <30039>; US
978,DR.,SARA,,MENDEZ,,F,12/01/1970,3395; Gabrielle Oval Oval; Sicklerville&; <30012>; US
979,MISS,REBECCA,,RUSSELL,,F,12/17/2015,131; Robert Mills Creek; Tyler&; <30066>; US
980,DR.,JOE,,WILLIAMS,,M,3/26/1928,39792; Oconnor Village Plains; Far Rockaway&; <30047>; US
981,MRS.,SHANNON,,WARD,,F,03/12/1910,85308; Adam Forest Rue; Laguna Niguel&; <30049>; US
982,DR.,JOHN,,TAYLOR,,M,6/21/1949,3025; Cooper Centers Plains; Tyler&; <30020>; US
983,DR.,JAMES,,HUGHES,,M,3/23/1975,879; Laura Trace Inlet; Nampa&; <30076>; US
984,MRS.,CHRISTINE,,PATEL,,F,5/23/2005,73003; Sarah Walk Lock; Utica&; <30023>; US
985,MISS,ANITA,,PARKS,,F,04/10/1993,2839; Henson Station Village; Bothell&; <30034>; US
986,MRS.,KATHERINE,,ZHANG,,F,7/21/1912,134; Dunn Route Pines; Crystal Lake&; <30087>; US
987,MS.,ERIN,,HODGES,,F,5/28/1991,771; Singleton Drive Route; Bothell West&; <30073>; US
988,MRS.,KRISTEN,,RODRIGUEZ,,F,02/05/1987,353; Sean Vista Turnpike; Keene&; <30036>; US
989,MR.,RICHARD,,KLEIN,,M,12/12/2013,7213; Christopher Plains Pike; Lino Lakes&; <30071>; US
990,DR.,TAMARA,,BERRY,,F,9/27/2018,51445; Ian Court Isle; Estelle&; <30031>; US
991,MR.,CHASE,,ALLEN,,M,06/10/1941,91436; Taylor Trafficway Drive; Tyler&; <30088>; US
992,MR.,JAMES,,HUTCHINSON,,M,11/18/1942,152; Miller Inlet Isle; Fitchburg&; <30027>; US
993,MR.,CHRISTOPHER,,KIM,,M,3/24/1949,1367; Charles Skyway Mountains; Keene&; <30080>; US
994,DR.,AMANDA,,BONILLA,,F,2/20/1931,1141; Webb View Heights; New City&; <30034>; US
995,DR.,JACOB,,HARDY,,M,04/06/1936,6278; Thomas Forge Valleys; Bothell&; <30063>; US
996,MR.,FRANK,,LEONARD,,M,05/03/1940,944; Hunter Squares Rue; Lower West Side&; <30061>; US
997,MISS,ANGELA,,REID,,F,11/07/1921,8922; Rowe Ford Lights; Bryn Mawr-Skyway&; <30037>; US
998,DR.,ROBERT,,ROBERTS,,M,01/04/1951,292; Newton Village Mountains; Kendall&; <30050>; US
999,DR.,CAROL,,COLEMAN,,F,4/25/1960,9833; Elizabeth Mill Wells; Ken Caryl&; <30045>; US
1000,MISS,ABIGAIL,,HOLLOWAY,,F,04/12/1993,7638; Benjamin Meadow Ferry; Lexington&; <30072>; US
1001,DR.,THEODORE,,MONTGOMERY,,M,12/11/1906,337; Anna Tunnel Road; Westchester&; <30098>; US
1002,MR.,JOHN,,PAUL,,M,1/26/1908,63959; Smith Grove Brook; Kent&; <30009>; US
1003,DR.,MARIAH,,ROSARIO,,F,12/21/2002,19338; Melissa Stream Roads; Milledgeville&; <30057>; US
1004,MR.,CHRISTOPHER,,JORDAN,,M,3/27/1978,6499; Schultz Prairie Wall; Granger&; <30025>; US
1005,MISS,KATHERINE,,CUNNINGHAM,,F,3/15/1932,453; Mary Roads Throughway; Tyler&; <30019>; US
1006,MR.,NATHAN,,VANG,,M,3/24/2002,7543; Harris Harbor River; Kent&; <30050>; US
1007,MRS.,KAITLYN,,REYNOLDS,,F,03/12/1967,77967; Reynolds Well Port; Carlsbad&; <30081>; US
1008,DR.,COLLEEN,,PALMER,,F,3/30/1949,313; Figueroa Divide Islands; Middletown&; <30008>; US
1009,DR.,MONICA,,ANDREWS,,F,05/03/2015,815; Ruiz Ranch Crossing; Pahrump&; <30012>; US
1010,MR.,JEREMY,,BENTON,,M,10/05/1985,104; Rachel Station Street; Gilbert&; <30093>; US
1011,MRS.,HEATHER,,BERRY,,F,10/31/1946,57465; Dennis Plaza Island; Toledo&; <30010>; US
1012,MRS.,MARY,,WANG,,F,08/04/1908,42406; Sara Street Throughway; Pottstown&; <30015>; US
1013,MS.,JAIME,,DAVIS,,F,02/03/1921,447; Hamilton Cliff Valleys; Hutto&; <30057>; US
1014,MS.,ELIZABETH,,FOSTER,,F,09/03/1945,6561; John Island Radial; American Canyon&; <30099>; US
1015,MR.,KEITH,,EVANS,,M,09/06/1928,1190; Derek Parks Fords; Norwalk&; <30063>; US
1016,MR.,WILLIAM,,ROMERO,,M,03/02/2003,41292; Mcdowell Crossroad Plaza; Vestavia Hills&; <30043>; US
1017,MISS,SAMANTHA,,VAZQUEZ,,F,02/05/1974,6430; Rogers Glens Roads; Hutto&; <30004>; US
1018,MRS.,CRYSTAL,,HUFFMAN,,F,4/23/1920,43221; Andrews Port Falls; North Tustin&; <30068>; US
1019,DR.,AARON,,WEAVER,,M,8/25/1984,33546; Jason Wells Wells; Fayetteville&; <30039>; US
1020,MRS.,LAURA,,SCHNEIDER,,F,10/21/1910,34050; Shawn Fort Spring; Harrisburg&; <30014>; US
1021,DR.,JOSE,,SCOTT,,M,9/28/1979,26; Cooper Oval Parkways; Muskogee&; <30019>; US
1022,MS.,ISABELLA,,HUGHES,,F,05/12/1969,1354; Chad Center Cliff; Beaumont&; <30027>; US
1023,MRS.,EMMA,,AUSTIN,,F,12/22/1997,56; Kristin Meadow Burgs; Sunnyside&; <30010>; US
1024,MS.,KIMBERLY,,CURRY,,F,1/30/1924,473; Coleman Ridges Lock; Palm Desert&; <30097>; US
1025,MRS.,SYLVIA,,JOHNSON,,F,04/11/1972,173; Randy Key Spurs; Woodlawn&; <30094>; US
1026,MR.,JACOB,,ROBERTS,,M,2/21/1929,93008; David Bridge Garden; Santa Maria&; <30069>; US
1027,MR.,JUSTIN,,WALTER,,M,1/31/1989,29962; Gregory Lakes Fall; Rutland&; <30048>; US
1028,MRS.,TAMMY,,STRONG,,F,6/25/1969,85622; Nixon Court Shoals; Camarillo&; <30029>; US
1029,MR.,JAMES,,VEGA,,M,12/09/1979,809; Riley Shores Knolls; Santa Maria&; <30084>; US
1030,DR.,MARK,,BARRON,,M,9/24/1939,309; Berg Ways Mountain; Venice&; <30066>; US
1031,MR.,DENNIS,,FLOWERS,,M,9/29/1987,211; Santiago Ports Row; Opportunity&; <30076>; US
1032,DR.,JOHN,,ANDREWS,,M,03/04/1940,7155; Christina Ridge Grove; Beaumont&; <30065>; US
1033,MR.,RICHARD,,GOODWIN,,M,04/06/1976,755; Mary Plains Mountains; Sicklerville&; <30019>; US
1034,MRS.,BARBARA,,HOFFMAN,,F,08/09/1942,508; Patty Rest Fall; Sicklerville&; <30026>; US
1035,MRS.,LISA,,ANDERSON,,F,7/25/1912,893; Alicia Expressway Tunnel; Norwalk&; <30011>; US
1036,MR.,DWAYNE,,KING,,M,08/03/2017,502; Carroll Square Springs; Keizer&; <30080>; US
1037,MRS.,JILL,,FRITZ,,F,3/17/1911,99; Madison Pike Heights; Camarillo&; <30087>; US
1038,DR.,GARY,,LARSON,,M,01/12/2002,321; Fry Ridge Walk; Odessa&; <30045>; US
1039,MR.,JEFF,,SINGH,,M,1/18/1989,57696; Steele Circles Prairie; Utica&; <30078>; US
1040,DR.,LINDSEY,,HAYES,,F,5/13/1929,3660; Eric Landing Drive; Claremont&; <30062>; US
1041,MRS.,LAURA,,SMITH,,F,12/29/1945,8888; Cheryl Roads Square; Glendale&; <30054>; US
1042,MRS.,NICOLE,,MACK,,F,06/08/1911,1278; Robert Freeway View; Gilbert&; <30086>; US
1043,MRS.,TAMMY,,CASEY,,F,5/26/1979,15989; Sarah Spur Extension; Lower West Side&; <30055>; US
1044,MRS.,LINDA,,BRIDGES,,F,1/25/1969,508; Sharp Motorway Fords; Crystal Lake&; <30041>; US
1045,MS.,CYNTHIA,,BARTON,,F,02/12/2002,4090; Susan Inlet Plains; Dumont&; <30008>; US
1046,DR.,MICHELLE,,SNOW,,F,1/28/1945,8314; Catherine Fields Hollow; Port Richmond&; <30090>; US
1047,MR.,JUAN,,COMPTON,,M,09/10/1957,393; Nancy Turnpike Island; Middle River&; <30085>; US
1048,MR.,KYLE,,KING,,M,04/12/1989,73; Moore Circles Mountain; Kent&; <30077>; US
1049,DR.,MICHAEL,,GARNER,,M,03/08/1907,865; Wilson Meadow Forge; Norco&; <30040>; US
1050,MR.,EDWARD,,MCDANIEL,,M,03/09/1942,1640; Swanson Mountains Mission; East Haven&; <30091>; US
1051,MR.,KEVIN,,HARRELL,,M,7/20/1956,177; Williams Estates Branch; Brentwood Estates&; <30041>; US
1052,MRS.,PAULA,,BRADY,,F,11/15/2013,19094; Sean Mountains Freeway; Searcy&; <30003>; US
1053,MR.,JAMES,,HENDERSON,,M,2/19/1916,98019; Rhonda Meadows Common; Norco&; <30061>; US
1054,MRS.,LAUREN,,WILLIAMS,,F,11/23/1982,36446; Anthony Summit Square; Pleasant Prairie&; <30076>; US
1055,DR.,MICHELLE,,SIMMONS,,F,06/01/1990,74; Wilson Causeway Prairie; Longview&; <30096>; US
1056,MRS.,TAYLOR,,MALDONADO,,F,12/24/2006,79815; Davis Brooks Crescent; Porterville&; <30036>; US
1057,MR.,PHILLIP,,BENNETT,,M,9/26/1998,692; Claudia Divide Club; Sunnyside&; <30032>; US
1058,DR.,REBECCA,,LONG,,F,1/29/1945,660; Alexandra Circle Skyway; Kendall&; <30018>; US
1059,DR.,ERICA,,LOPEZ,,F,2/28/1955,75; Robert Canyon Drive; Punta Gorda Isles&; <30070>; US
1060,MR.,CHAD,,NGUYEN,,M,09/02/1934,7392; David Island Vista; Muskogee&; <30083>; US
1061,DR.,MADISON,,SMITH,,F,4/14/1923,9119; David Ridge Prairie; Cypress Hills&; <30019>; US
1062,DR.,JOHNATHAN,,DECKER,,M,6/25/1930,5201; Smith Vista Fall; West Des Moines&; <30015>; US
1063,MRS.,HEATHER,,JACKSON,,F,10/11/2006,270; Rodriguez Ports Hill; Porterville&; <30095>; US
1064,MR.,PAUL,,THOMAS,,M,06/08/1914,65; Lee Spur Common; Norwalk&; <30035>; US
1065,MR.,ERIK,,DILLON,,M,7/22/1972,578; Joseph Oval Track; West Chester&; <30036>; US
1066,MR.,GEORGE,,CRUZ,,M,05/09/1993,5024; Campos Mews Forges; Norco&; <30047>; US
1067,DR.,TIFFANY,,RAYMOND,,F,9/23/1976,69200; Huynh Estate Extension; Lakewood&; <30053>; US
1068,MR.,JAMES,,JOHNSTON,,M,11/04/2011,6904; Hooper Spring Hollow; Palestine&; <30078>; US
1069,MR.,JAMES,,HALL,,M,7/28/2004,153; Alyssa Union Isle; Jackson&; <30044>; US
1070,MR.,ANDREW,,PRINCE,,M,7/28/2015,636; Larson Inlet Garden; Waterbury&; <30093>; US
1071,MR.,DANIEL,,GUERRERO,,M,09/06/1997,87798; Wilson Drive River; Brenham&; <30050>; US
1072,MR.,TIMOTHY,,BALL,,M,02/10/1986,3317; Burton Skyway Prairie; Jackson&; <30067>; US
1073,MRS.,STACY,,FOSTER,,F,04/05/1909,547; Christopher Fork Junction; Sterling&; <30004>; US
1074,MR.,STEVEN,,HART,,M,4/29/1985,44; Mccoy Field Flat; Chillum&; <30086>; US
1075,MR.,EDDIE,,STARK,,M,07/11/1988,42548; Emily Forks Coves; Sunnyside&; <30030>; US
1076,MRS.,LEAH,,PALMER,,F,04/06/1996,900; Danielle Loop Streets; Bryn Mawr-Skyway&; <30096>; US
1077,MR.,JAMES,,MORGAN,,M,1/23/2016,860; Ray Wells Tunnel; Nampa&; <30096>; US
1078,MR.,RICHARD,,WILLIAMS,,M,6/27/1930,629; Nancy Village Brook; Lower West Side&; <30076>; US
1079,MRS.,BRENDA,,SWANSON,,F,1/29/1992,1694; Susan Springs Vista; Coralville&; <30045>; US
1080,MISS,JUDY,,FLORES,,F,9/29/1986,7810; Erik Mountain Plain; Nampa&; <30082>; US
1081,DR.,KIMBERLY,,DAVIS,,F,1/17/1953,7983; Joseph Shores Valley; Longview&; <30070>; US
1082,MR.,JASON,,BROWN,,M,9/25/2020,38051; Bates Well Place; Fort Washington&; <30053>; US
1083,DR.,MELISSA,,HAYES,,F,10/28/1964,2274; Thompson Stream Lodge; Santa Maria&; <30049>; US
1084,MR.,JUSTIN,,BURNETT,,M,12/07/1976,4916; Ryan Path Harbor; Lebanon&; <30084>; US
1085,DR.,JOHN,,KENNEDY,,M,03/11/1968,26079; Frost Loaf Creek; San Juan&; <30019>; US
1086,MISS,MONIQUE,,WILSON,,F,05/09/1970,957; Susan Vista Spring; Chillum&; <30086>; US
1087,MR.,NICHOLAS,,FROST,,M,12/14/1922,4924; Lloyd Camp Road; Lakewood&; <30062>; US
1088,DR.,KATIE,,CUNNINGHAM,,F,09/12/1912,181; Paul Junction Junctions; Kahului&; <30085>; US
1089,MR.,ROBERT,,CAMPBELL,,M,2/14/1977,9514; Perry Stream Terrace; Brunswick&; <30064>; US
1090,DR.,MICHELE,,GRIFFIN,,F,3/16/1919,78313; Jerome Landing Crest; Brighton Beach&; <30059>; US
1091,MRS.,LISA,,MENDOZA,,F,07/02/2010,1283; Joyce Roads Walk; Clermont&; <30044>; US
1092,MR.,JAMES,,BOOTH,,M,3/29/1914,17813; John Crest Place; Mechanicsville&; <30012>; US
1093,MR.,RANDALL,,HUGHES,,M,07/08/1909,97126; Barrett Ford Club; Tupelo&; <30036>; US
1094,DR.,TERESA,,BUTLER,,F,07/11/1977,211; Richardson Prairie Villages; Schererville&; <30077>; US
1095,DR.,JAMES,,MUELLER,,M,3/20/1993,512; Hall Cove Fork; Fairview Heights&; <30074>; US
1096,DR.,ANTONIO,,SMITH,,M,02/10/1952,575; Smith Pine Inlet; Ada&; <30028>; US
1097,MS.,EMILY,,HILL,,F,1/15/1969,45001; Joyce Skyway Crossroad; North Tustin&; <30062>; US
1098,MRS.,KENDRA,,RODRIGUEZ,,F,5/13/1991,2758; Kelli Crossroad Gardens; San Juan&; <30018>; US
1099,MR.,DAVID,,WARE,,M,6/24/1998,5247; White Parkways Spur; Kensington&; <30021>; US
1100,MISS,SHEILA,,MARTINEZ,,F,08/09/1969,5282; Anderson Mission Landing; Tyler&; <30083>; US
1101,DR.,KEVIN,,BROOKS,,M,10/24/1949,950; Allen Expressway Neck; Claremont&; <30058>; US
1102,DR.,JERRY,,DAVIS,,M,8/17/1972,51698; Williams Drives Ramp; Hutchinson&; <30070>; US
1103,MR.,SETH,,WATERS,,M,11/04/2009,1138; Griffin Gateway Ports; Fort Washington&; <30027>; US
1104,MR.,ROBERT,,KING,,M,12/30/1975,6038; Nathan Mountain Plain; Vestavia Hills&; <30018>; US
1105,DR.,JAMES,,MCCLURE,,M,1/17/1965,44291; Meyers Streets Forge; Chillum&; <30072>; US
1106,MR.,LONNIE,,COOPER,,M,07/08/1987,880; Riley Via Cliffs; Fresno&; <30070>; US
1107,MRS.,SANDRA,,MORGAN,,F,12/12/2005,3343; Lucero Stream Road; Muskogee&; <30045>; US
1108,MR.,GARY,,WALLACE,,M,7/13/1983,732; Young Light Trail; Sun City Center&; <30079>; US
1109,MR.,DAVID,,SHEPHERD,,M,4/30/1962,77241; Johnson Flats Road; Muskogee&; <30087>; US
1110,MS.,CHEYENNE,,HUGHES,,F,3/29/1996,43702; Robertson Cove Underpass; North Tustin&; <30078>; US
1111,MR.,ERIC,,MULLINS,,M,2/19/1913,8398; Ryan Village Pass; Pleasant Prairie&; <30072>; US
1112,MRS.,TRACY,,VINCENT,,F,07/06/1968,947; Thomas Isle Ford; Brighton Beach&; <30006>; US
1113,MR.,ROBERT,,BRYANT,,M,07/05/1977,68490; Jones Creek Mount; Cypress Hills&; <30082>; US
1114,MR.,NATHANIEL,,PATEL,,M,7/19/1954,1234; Shepherd River Ridge; New Canaan&; <30007>; US
1115,MRS.,LAURA,,PIERCE,,F,7/27/1942,61017; Martinez Greens Hollow; Fresno&; <30001>; US
1116,DR.,ERIC,,WATKINS,,M,5/25/1994,5200; White Court Mission; Redding&; <30067>; US
1117,MISS,LINDSAY,,HAMILTON,,F,8/20/1915,931; Jeffrey Radial Skyway; American Canyon&; <30049>; US
1118,DR.,JOSEPH,,CALHOUN,,M,10/28/1955,1303; Nguyen Roads Roads; Bridgeport&; <30047>; US
1119,MR.,KENNETH,,BOYD,,M,9/30/1943,5379; Barbara Rue Well; Yonkers&; <30006>; US
1120,MISS,DONNA,,NELSON,,F,12/28/1944,3079; Matthew Harbors Ramp; Middle River&; <30008>; US
1121,MRS.,KENDRA,,CHANG,,F,1/22/1984,4825; Christie Courts Trail; Kaukauna&; <30022>; US
1122,MRS.,LISA,,MURRAY,,F,04/12/1911,2960; Jones Prairie Estates; Sicklerville&; <30002>; US
1123,DR.,JESSICA,,WEEKS,,F,8/24/1998,77875; Kane Locks Isle; Far Rockaway&; <30087>; US
1124,DR.,SUZANNE,,MARSHALL,,F,3/31/1987,9043; Wallace Wells Unions; Iron River&; <30077>; US
1125,MRS.,CATHERINE,,DUARTE,,F,08/05/1913,3828; Taylor Harbors Bridge; Estelle&; <30029>; US
1126,MRS.,HANNAH,,GOODWIN,,F,11/15/1951,829; Davis Loaf Orchard; Jersey City&; <30003>; US
1127,DR.,LINDA,,FLOWERS,,F,02/08/1959,8911; Brian Island Curve; Beaumont&; <30013>; US
1128,DR.,CRYSTAL,,JOHNSON,,F,3/19/1982,4349; Justin Viaduct Canyon; Hutchinson&; <30084>; US
1129,DR.,BRANDON,,FITZPATRICK,,M,10/16/1911,8780; Brian Freeway Falls; Norco&; <30065>; US
1130,MRS.,TAYLOR,,PRATT,,F,2/28/1917,160; Ashley Fall Courts; Camarillo&; <30008>; US
1131,DR.,KATHLEEN,,SHANNON,,F,1/19/1914,813; Hopkins Drive Union; Fresno&; <30037>; US
1132,MISS,DEBORAH,,ROGERS,,F,3/29/1969,32707; Joshua Center Branch; Sterling&; <30083>; US
1133,MRS.,SHARON,,HAWKINS,,F,07/12/1994,25587; Wyatt Ways Rue; Taunton&; <30088>; US
1134,DR.,DONALD,,DELEON,,M,4/20/1905,99541; Grant Villages Islands; Lutz&; <30058>; US
1135,DR.,CARMEN,,WILLIAMS,,F,11/23/1914,83; Nguyen Wells Cliff; Redding&; <30011>; US
1136,MISS,VICTORIA,,VILLARREAL,,F,12/09/1911,215; Guerra Roads Summit; Clermont&; <30034>; US
1137,MISS,KRISTINA,,FERRELL,,F,7/25/1927,8155; Parker Lock Glen; South Whittier&; <30016>; US
1138,MRS.,WENDY,,POPE,,F,06/01/2009,224; Ryan Expressway Rapid; Bothell West&; <30059>; US
1139,MR.,JAMES,,SANCHEZ,,M,03/05/1966,63940; Scott Ways Circles; Fitchburg&; <30021>; US
1140,DR.,STEPHEN,,NAVARRO,,M,7/18/2015,446; Ward Light Branch; Bon Air&; <30053>; US
1141,MRS.,SHARON,,HOLMES,,F,9/20/1977,88778; Joshua Fort Manors; Greenville&; <30020>; US
1142,MRS.,AMANDA,,WATSON,,F,8/26/1917,2749; Dawn Ranch Well; Chillum&; <30063>; US
1143,DR.,ROY,,RODGERS,,M,1/26/1907,351; Samuel Mount Circle; Middle River&; <30064>; US
1144,MRS.,MELISSA,,COLE,,F,10/06/1994,4345; Karl Mall Ways; Visitacion Valley&; <30016>; US
1145,DR.,MITCHELL,,MEDINA,,M,08/02/1978,998; Leonard Flats Walk; Gainesville&; <30002>; US
1146,MRS.,MARIA,,ATKINSON,,F,8/14/1974,10045; Vega Circles Gardens; Mira Mesa&; <30068>; US
1147,MRS.,BRENDA,,PORTER,,F,12/07/1959,52329; Christopher Junction Walks; Riverbank&; <30085>; US
1148,MR.,NICHOLAS,,PATTERSON,,M,6/27/1912,8652; Nathan Hill Gardens; Porterville&; <30045>; US
1149,MRS.,JENNIFER,,GUERRERO,,F,05/02/1987,762; Moore Forges Via; Encinitas&; <30044>; US
1150,MRS.,DAWN,,MORAN,,F,11/01/1944,724; Kyle Plaza Trail; Pahrump&; <30031>; US
1151,DR.,KYLE,,ANDREWS,,M,09/03/1907,916; Nicole Path Orchard; Evergreen Park&; <30043>; US
1152,MR.,CORY,,MCGUIRE,,M,6/17/1923,1514; Cheryl Circle Ports; Opportunity&; <30054>; US
1153,MR.,JON,,YU,,M,1/23/2011,703; Shelby Avenue Mount; Rosedale&; <30080>; US
1154,MRS.,SONYA,,HOFFMAN,,F,6/27/1950,52022; Brooke Mountain Coves; Jersey City&; <30059>; US
1155,MRS.,KELLY,,ALEXANDER,,F,06/03/1931,228; Jaime Rapid Key; Aloha&; <30086>; US
1156,MR.,JOHN,,CRUZ,,M,03/06/1959,19; Roth Ridge Rapids; Sun City Center&; <30032>; US
